Sierra,CHIMBORAZO,milk,cattle,(unknown),1 kg FPCM,1.0,0.06855001681595341,15.012399500618136,82.56819725339975,,1.0,0.0376,0.5644662212232419,0.0,0.0,0.0,0.0,0.5644662212232419,0.0,5.124170692222431,0.05124170692222431,15.012399500618136,1.0175658112214756,1.0,7.12296067855033,7.0,,,,,,,0.013516665859058603,0.0,0.013516665859058603,0.8540284487037384,0.12422231981145286,0.03700239313532639,0.0,0.0,0.00034782249547206807,0.0,0.0,0.0,0.12539000961768054,,,,,,0.3958815560799741,0.5,4.0,2.0,,dairy_cow,"dairy cow, at farm {BR} Economic, U",Mecánico,milking system: Mecánico,ESPAC direct (gl_sistema_ordenio),,,60.0,0.6,400.0,145.45454545454547,23.5,23.094329369999997,164.5,161.66030559,5.916666666666667,,,,,,,,80.0,0.25,0.0,0.25,100.0,0.0,0.05333333333333334,0.0,90.0,0.0,0.0,20.0,,,10.0,1.4545454545454546,1.6363636363636365,0.0,0.0,0.36363636363636365,0.0,0.0,0.0,0.0,1.8181818181818181,,,,,,,,,,,4.0,100.0,mixed: direct ESPAC infrastructure + literature proxy water/electricity,infrastructure from ESPAC cattle milking-system field; water/electricity from literature proxy,FAO small-scale dairy manual - Lactating-cow water use increases with dry matter intake and milk output; a reduced 60 L/day proxy was retained for milk rows with unspecified system. (https://www.fao.org/4/t1265e/t1275e01.htm) | Uruguay MGAP dairy intermediate-consumption report - Latin American dairy energy benchmarks were scaled to 0.6 kWh/head/day for milk rows with unspecified system. (https://www.gub.uy/ministerio-ganaderia-agricultura-pesca/sites/ministerio-ganaderia-agricultura-pesca/files/documentos/publicaciones/informe_consumo_intermedio.pdf),23.094329369999997,8429.43022005,0.08540284487037385,Milk liters/day converted to kg FPCM using 0.982737 kg FPCM/L; live-weight-equivalent per kg FPCM is based on total herd live weight divided by total milk output; DFE annualizes this daily output by multiplying by 365.,kg FPCM/day,kg FPCM/7d,as-fed kg/head/day,,"share-based, absolute kg/head/day estimated from configured intake assumption","pasture + supplement shares from ESPAC cattle module; pasture share split across linked cultivated pasture, linked natural pasture, and unmatched residual using holding-level ESPAC pasture areas",,,,
Sierra,CHIMBORAZO,milk,cattle,beef,1 kg FPCM,1.0,0.10514846715955248,12.334131045108796,67.83772074809838,,1.0,0.0376,0.46376332729609077,0.0,0.0,0.0,0.0,0.46376332729609077,0.0,8.721992667612648,0.04360996333806324,12.334131045108796,1.0175658112214756,1.0,6.331520603155848,6.222222222222222,,,,,,,0.02992840621239634,0.0,0.041274764206936716,1.1629323556816864,0.21144224648757934,0.07835800899245587,0.0,0.0,0.00036243688603812134,0.0,0.0,0.0,0.21144224648757934,,,,,,0.44094518486263945,1.04,5.0,2.0,,dairy_cow,"dairy cow, at farm {BR} Economic, U",Mecánico,milking system: nan,ESPAC direct (gl_sistema_ordenio),,,60.0,0.3,400.0,145.45454545454547,6.0,5.89642452,42.0,41.27497164,6.0,,,,,,,,100.0,0.09,0.0,0.333841545698,100.0,0.0,0.0,0.0,78.55011888184838,0.0,0.0,10.0,,,8.0,1.4545454545454546,1.1425471837359764,0.0,0.0,0.14545454545454548,0.0,0.0,0.0,0.0,1.4545454545454546,,,,,,,,,,,3.0,100.0,mixed: direct ESPAC infrastructure + literature proxy water/electricity,infrastructure from ESPAC cattle milking-system field; water/electricity from literature proxy,FAO small-scale dairy manual - Lactating-cow water use increases with dry matter intake and milk output; a reduced 60 L/day proxy was retained for low-intensity milk output in non-dairy systems. (https://www.fao.org/4/t1265e/t1275e01.htm) | Uruguay MGAP dairy intermediate-consumption report - Latin American dairy energy benchmarks were strongly downscaled to 0.3 kWh/head/day for occasional milk handling in beef-oriented systems. (https://www.gub.uy/ministerio-ganaderia-agricultura-pesca/sites/ministerio-ganaderia-agricultura-pesca/files/documentos/publicaciones/informe_consumo_intermedio.pdf),5.89642452,2152.1949498,0.1453665444602108,Milk liters/day converted to kg FPCM using 0.982737 kg FPCM/L; live-weight-equivalent per kg FPCM is based on total herd live weight divided by total milk output; DFE annualizes this daily output by multiplying by 365.,kg FPCM/day,kg FPCM/7d,as-fed kg/head/day,,"share-based, absolute kg/head/day estimated from configured intake assumption","pasture + supplement shares from ESPAC cattle module; pasture share split across linked cultivated pasture, linked natural pasture, and unmatched residual using holding-level ESPAC pasture areas",,,,
Sierra,CHIMBORAZO,milk,cattle,dairy,1 kg FPCM,1.0,0.06444583471069346,11.893626364926337,65.41494500709486,,1.0,0.0376,0.4472003513212303,0.0,0.0,0.0,0.0,0.4472003513212303,0.0,4.477289569374493,0.10175658112214757,11.893626364926337,1.0175658112214756,1.0,6.937948712873698,6.818181818181818,,,,,,,0.015602675772062626,0.0,0.03205332305347648,0.8140526489771805,0.133208615287175,0.05920382901652222,0.0,0.0,0.0005565159927553089,0.0,0.0,0.0,0.1337651312799303,,,,,,0.3052697433664427,0.9,5.0,2.0,,dairy_cow,"dairy cow, at farm {BR} Economic, U",Mecánico,milking system: Mecánico,ESPAC direct (gl_sistema_ordenio),,,66.0,1.5,450.0,163.63636363636363,15.0,14.7410613,100.0,98.273742,6.666666666666667,,,,,,,,90.0,0.25,0.0,0.5,100.0,0.0,0.03571428571428571,0.0,80.0,0.0,0.0,10.0,,,12.0,1.9636363636363638,1.7454545454545454,0.0,0.0,0.21818181818181817,0.0,0.0,0.0,0.0,2.1818181818181817,,,,,,,,,,,5.0,100.0,mixed: direct ESPAC infrastructure + literature proxy water/electricity,infrastructure from ESPAC cattle milking-system field; water/electricity from literature proxy,"FAO small-scale dairy manual - Uses 4 to 6 L water per kg dry matter intake; the worked example for a 300 kg cow producing 10 kg milk/day gives about 66 L/day, adopted here as the milk-row water proxy. (https://www.fao.org/4/t1265e/t1275e01.htm) | FAO Milking, milk collection and transport - Gives wash-water benchmarks for hand, bucket, and pipeline milking plus plate-cooler water loads, supporting a dedicated dairy handling infrastructure proxy. (https://www.fao.org/4/i2433e/i2433e07.pdf) | Uruguay MGAP dairy intermediate-consumption report - Provides Latin American dairy infrastructure energy benchmarks for milking-room electricity and milk cooling; a rounded 1.5 kWh/cow/day proxy was adopted as a moderate regional milking-plus-cooling estimate. (https://www.gub.uy/ministerio-ganaderia-agricultura-pesca/sites/ministerio-ganaderia-agricultura-pesca/files/documentos/publicaciones/informe_consumo_intermedio.pdf)",14.7410613,5380.4873745,0.06783772074809838,Milk liters/day converted to kg FPCM using 0.982737 kg FPCM/L; live-weight-equivalent per kg FPCM is based on total herd live weight divided by total milk output; DFE annualizes this daily output by multiplying by 365.,kg FPCM/day,kg FPCM/7d,as-fed kg/head/day,,"share-based, absolute kg/head/day estimated from configured intake assumption","pasture + supplement shares from ESPAC cattle module; pasture share split across linked cultivated pasture, linked natural pasture, and unmatched residual using holding-level ESPAC pasture areas",,,,
Sierra,CHIMBORAZO,milk,cattle,dual-purpose,1 kg FPCM,1.0,0.13024842383634888,12.334131045108796,67.83772074809838,,1.0,0.0376,0.46376332729609077,0.0,0.0,0.0,0.0,0.46376332729609077,0.0,4.696457590252965,0.04696457590252965,12.334131045108796,1.0175658112214756,1.0,6.783772074809837,6.666666666666666,,,,,,,0.03731074641145411,0.0,0.0542701765984787,0.7827429317088275,0.12334131045108795,0.08325538455448438,0.0,0.0,0.0005574078453078014,0.0,0.0,0.0,0.12334131045108795,,,,,,0.4070263244885903,1.32,6.0,2.0,,dairy_cow,"dairy cow, at farm {BR} Economic, U",Mecánico,milking system: Mecánico,ESPAC direct (gl_sistema_ordenio),,,60.0,0.6,400.0,145.45454545454547,12.0,11.79284904,105.0,103.1874291,6.0,,,,,,,,90.0,0.28,0.0,0.5,100.0,0.0,0.0475,0.0,80.0,0.0,0.0,10.0,,,10.0,1.6363636363636365,1.4545454545454546,0.0,0.0,0.18181818181818182,0.0,0.0,0.0,0.0,1.8181818181818181,,,,,,,,,,,7.0,100.0,mixed: direct ESPAC infrastructure + literature proxy water/electricity,infrastructure from ESPAC cattle milking-system field; water/electricity from literature proxy,FAO small-scale dairy manual - Lactating-cow water use increases with dry matter intake and milk output; a reduced 60 L/day proxy was retained for lower-intensity dual-purpose milk systems. (https://www.fao.org/4/t1265e/t1275e01.htm) | Uruguay MGAP dairy intermediate-consumption report - Latin American dairy energy benchmarks were scaled down to 0.6 kWh/head/day for lower-intensity dual-purpose milk handling. (https://www.gub.uy/ministerio-ganaderia-agricultura-pesca/sites/ministerio-ganaderia-agricultura-pesca/files/documentos/publicaciones/informe_consumo_intermedio.pdf),11.79284904,4304.3898996,0.07827429317088275,Milk liters/day converted to kg FPCM using 0.982737 kg FPCM/L; live-weight-equivalent per kg FPCM is based on total herd live weight divided by total milk output; DFE annualizes this daily output by multiplying by 365.,kg FPCM/day,kg FPCM/7d,as-fed kg/head/day,,"share-based, absolute kg/head/day estimated from configured intake assumption","pasture + supplement shares from ESPAC cattle module; pasture share split across linked cultivated pasture, linked natural pasture, and unmatched residual using holding-level ESPAC pasture areas",,,,
Sierra,CHIMBORAZO,mule_live,mule,(all holdings),1 kg live weight equivalent,1.0,0.0048142857142857145,,,,1.0,,,0.0,0.0,0.0,0.0,0.0,0.0,0.1,0.0,1.0,,,,,,,,,,,,,,0.02,0.0,0.0,0.0,0.0,0.0,0.0,0.0,0.02,0.02,0.02,0.02,0.0,0.0,0.0,,1.685,1.0,,,,,,mule holding with shelter and trough,literature/system proxy,,,35.0,0.0,350.0,350.0,,,,,,,,,,,,,0.0,,,,,,,,0.0,0.0,0.0,0.0,0.0,0.0,7.0,0.0,0.0,0.0,0.0,0.0,0.0,0.0,100.0,7.0,7.0,7.0,350.0,100.0,0.0,0.0,0.0,7.0,0.0,0.0,0.0,,,literature/system proxy,ESPAC livestock modules do not expose direct infrastructure/water/electricity variables for this row; literature/system proxy attached,WSU horse winter water note - Mule water proxy was scaled from the horse baseline by representative body weight because no ESPAC or Ecuador-specific mule water field was available. (https://s3.wp.wsu.edu/uploads/sites/2070/2024/01/1.24.pdf),350.0,350.0,0.002857142857142857,Animals_total_head multiplied by representative live weight to express kg live weight equivalent.,kg live weight equivalent,,dry-matter kg/head/day,dry-matter kg/head/day,no diet share data in ESPAC; literature proxy attached from config,no diet/ration fields found in other livestock module; literature proxy diet attached from inputs/02-05_espac_lci_coefficients.yml; main feed columns mapped from proxy diet components,mule_live,Non-Ecuador fallback inference,"Derived as 2.0% of body weight in dry matter, using the midpoint of the 1.75% to 2.25% maintenance guideline for a representative 350 kg mule.",Management recommendations for donkeys and mules - Ontario guidance gives 1.75% to 2.25% of body weight dry matter intake for maintenance in donkeys and mules; proxy uses the midpoint and a representative 350 kg body weight. (https://www.ontario.ca/page/management-recommendations-donkeys-and-mules)
Sierra,CHIMBORAZO,ovine_live,ovine,(all ovine),1 kg meat (carcass-weight proxy),1.0,0.008992029465082152,2.1739130434782608,,1.0869565217391304,2.0,1.0,4.3478260869565215,0.0,0.0,0.0,4.3478260869565215,0.0,0.0,0.06833942393462435,0.0,2.1739130434782608,,,,,,,,,,,,,,0.011437861479584498,0.011392901332259085,0.0,0.0,0.011392901332259085,8.992029465082152e-05,0.0,0.0,2.0746250530971727e-18,0.011482821626909908,0.011437861479584498,0.008938077288291659,0.0024548240439674278,0.0,4.496014732541076e-05,,1.16,4.0,,2.0,kid_goat,"kid goat, conventional, intensive forage area, at farm gate {FR} U",,grazing ovine holding with shelter and trough,literature/system proxy,,,7.6,0.0,60.44,241.76,,,,,,,,,,,,,99.6069182389937,,,,,,,,0.0,0.0,99.6069182389937,0.3930817610062893,0.0,0.0,1.272,1.267,0.0,0.0,1.267,0.005,0.0,0.0,9.069112511985665e-15,1.1535911115245767e-16,1.272,1.272,60.44,78.1,21.5,0.0,0.4,0.994,0.273,0.0,0.005,,,literature/system proxy,ESPAC livestock modules do not expose direct infrastructure/water/electricity variables for this row; literature/system proxy attached,FAO-linked livestock watering structures guideline - Reports feeder lamb and kid water requirements around 7.6 L/day and adult ewe or doe requirements above that level; 7.6 L/head/day was retained as a conservative live-animal proxy for mixed ovine rows. (https://www.fao.org/fileadmin/user_upload/emergencies/docs/UNEP_FAO_South_Sudan_WH_Structures_guidelines.pdf),111.2096,111.2096,0.008992029465082152,"Animals_total_head multiplied by representative live weight, then converted to estimated meat output with the configured carcass-yield proxy.",kg meat (carcass-weight proxy),head,dry-matter kg/head/day,dry-matter kg/head/day,no diet share data in ESPAC; literature proxy attached from config,"no diet/ration fields found in ovine module; literature proxy diet attached from inputs/02-05_espac_lci_coefficients.yml; main feed columns mapped from proxy diet as unmatched pasture for forage plus browse, with mineral or compound feed retained separately",ovine_live,Ecuador composite,Composite Ecuador proxy. Total intake is based on an ovine feeding trial; tree-forage share comes from Acacia mearnsii voluntary intake; mineral intake comes from a Blackbelly sheep grazing study in the Ecuadorian Amazon.,UTA thesis by Erika Esthefanía Lluay Guilcapi (bitstream 32507) - Reports voluntary dry matter intake of 1268.85 g/day in weaned sheep in Ecuador. (https://repositorio.uta.edu.ec/bitstream/123456789/32507/1/Tesis%20182%20Medicina%20Veterinaria%20y%20Zootecnia%20-Lluay%20Guilcapi%20Erika%20Esthefan%C3%ADa.pdf) | Evaluación de la preferencia de consumo de leguminosas arbóreas con potencial forrajero en rumiantes menores - Reports ovine Acacia mearnssi voluntary intake of 272.50 g/kg MS and 12.60 g/kg PV^0.75 at 60.44 kg live weight. (https://repositorio.uta.edu.ec/items/770d67bf-97e2-485a-8227-d941b7f4e1b2) | Effect of Mineral Supplementation on the Macromineral Concentration in Blood in Pre- and Postpartum Blackbelly Sheep - Reports 0.005 kg per animal per day mineral supplementation under free-grazing conditions in the Ecuadorian Amazon. (https://pmc.ncbi.nlm.nih.gov/articles/PMC7401505/)
Sierra,CHIMBORAZO,swine_live,swine,(all swine),1 kg meat (carcass-weight proxy),1.0,0.014500984858554977,1.5151515151515154,,1.5151515151515154,1.0,0.9372,1.4200000000000002,0.0,0.0,1.4200000000000002,0.0,0.0,0.0,0.07049089861797558,0.0006243479591877837,1.5151515151515154,,,,,,,,,,,,,,0.02517532093499128,0.0,0.0,0.0,0.0,0.005898577695068455,0.011797155390136913,0.023594310780273825,0.0,0.023594310780273825,,,,,,,1.3250000000000002,2.0,,2.0,piglet,"piglet, at farm {BR} Economic, U",,Ecuador smallholder pigsty or swine pen with feeder and drinker,literature/system proxy,,,7.0,0.062,75.23,150.46,,,,,,,,,,,,,0.0,,,,,,,,0.0,0.0,0.0,20.0,50.0,90.0,2.5,0.0,0.0,0.0,0.0,0.5,1.25,2.25,0.0,0.0,2.5,,,,,,,,,,,,,literature/system proxy,ESPAC livestock modules do not expose direct infrastructure/water/electricity variables for this row; literature/system proxy attached,"FAO Livestock housing for pigs - Pig water consumption varies by class from about 2.5 L/day at 25 kg to 7.0 L/day at 90 to 120 kg; 7.0 L/head/day was adopted as a practical market-pig proxy for mixed ESPAC swine rows. (https://www.fao.org/3/s1250e/S1250E14.htm) | Caracterización de granjas porcinas de Banasur, Pasaje, El Oro - Provides Ecuador smallholder swine-system context and supports the use of a simple pen-based infrastructure proxy, although it does not provide a clean biological drinking-water factor. (https://polodelconocimiento.com/ojs/index.php/es/article/view/1043/html) | National Hog Farmer study summary - Finishing-barn electricity around 11.2 kWh per finished pig produced was annualized over a 180-day finishing period to derive a daily proxy. (https://www.nationalhogfarmer.com/livestock-management/study-goes-to-pig-barns-to-find-actual-energy-use)",99.3036,99.3036,0.010070128373996512,"Animals_total_head multiplied by representative live weight, then converted to estimated meat output with the configured carcass-yield proxy.",kg meat (carcass-weight proxy),head,as-fed kg/head/day,,"share-based, absolute kg/head/day estimated from configured intake assumption",common feed + supplement + waste shares from ESPAC swine module,,,,
Sierra,COTOPAXI,cattle_live,cattle,(unknown),1 kg meat (carcass-weight proxy),1.0,0.003109472049689441,2.0,0.12422360248447205,,,0.0673,,,0.0,0.0,0.0,0.0,0.0,0.04166666666666667,0.0,2.0,,,,,,,,,,,0.000625,0.000625,0.003109472049689441,0.008333333333333333,0.008333333333333333,0.00015527950310559007,0.00625,0.0,,0.0,0.0,0.0,0.008333333333333333,,,,,,0.005,8.934999999999999,8.0,10.0,,calf,"calf, at farm {BR} Economic, U",Mecánico,milking system: nan,ESPAC direct (gl_sistema_ordenio),,,50.0,0.0,400.0,3200.0,,,,,,,,,,,,,100.0,1.5,0.5,8.934999999999999,50.0,50.0,0.125,0.125,50.0,50.0,0.0,,,,10.0,10.0,5.0,5.0,0.0,,0.0,0.0,0.0,0.0,10.0,,,,,,,,,,,12.0,100.0,mixed: direct ESPAC infrastructure + literature proxy water/electricity,infrastructure from ESPAC cattle milking-system field; water/electricity from literature proxy,FAO Livestock housing water requirements - Reports dry dairy cow water requirements around 40 to 60 L/day; the midpoint 50 L/day was adopted when the cattle system is unspecified. (https://www.fao.org/3/S1250E/S1250E12.htm),1600.0,1600.0,0.0008333333333333334,"Animals_total_head multiplied by representative live weight, then converted to estimated meat output with the configured carcass-yield proxy.",kg meat (carcass-weight proxy),,as-fed kg/head/day,,"share-based, absolute kg/head/day estimated from configured intake assumption","pasture + supplement shares from ESPAC cattle module; pasture share split across linked cultivated pasture, linked natural pasture, and unmatched residual using holding-level ESPAC pasture areas",,,,
Sierra,COTOPAXI,cattle_live,cattle,beef,1 kg meat (carcass-weight proxy),1.0,0.0016035714285714286,2.0,0.908899420747762,0.6666666666666667,3.0,0.0673,0.4038,0.4038,0.0,0.0,0.0,0.0,0.0,0.08333333333333334,0.0,2.0,,,,,,,,,,,0.00035833333333333333,0.0,0.00085411121855375,0.013333333333333334,0.012666666666666666,0.005142626285460987,0.0,0.0,0.0008,0.0,0.0,0.0,0.013333333333333334,,,,,,0.005,0.95,3.0,3.0,2.0,calf,"calf, at farm {BR} Economic, U",Mecánico,milking system: nan,ESPAC direct (gl_sistema_ordenio),,,50.0,0.0,400.0,1200.0,,,,,,,,,,,,,100.0,0.16499999999999998,0.0,0.5,100.0,0.0,0.04,0.0,90.0,0.0,0.0,10.0,,,8.0,8.0,7.2,0.0,0.0,0.8,0.0,0.0,0.0,0.0,8.0,,,,,,,,,,,4.0,100.0,mixed: direct ESPAC infrastructure + literature proxy water/electricity,infrastructure from ESPAC cattle milking-system field; water/electricity from literature proxy,FAO Livestock housing water requirements - Reports dry dairy cow water requirements around 40 to 60 L/day; the midpoint 50 L/day was adopted for beef cattle. (https://www.fao.org/3/S1250E/S1250E12.htm),600.0,600.0,0.0016666666666666668,"Animals_total_head multiplied by representative live weight, then converted to estimated meat output with the configured carcass-yield proxy.",kg meat (carcass-weight proxy),,as-fed kg/head/day,,"share-based, absolute kg/head/day estimated from configured intake assumption","pasture + supplement shares from ESPAC cattle module; pasture share split across linked cultivated pasture, linked natural pasture, and unmatched residual using holding-level ESPAC pasture areas",,,,
Sierra,COTOPAXI,cattle_live,cattle,dairy,1 kg meat (carcass-weight proxy),1.0,0.0008888888888888889,2.0,1.0,0.4,5.0,0.0673,0.673,0.673,0.0,0.0,0.0,0.0,0.0,0.05866666666666667,0.0013333333333333335,2.0,,,,,,,,,,,0.0004071225071225071,0.0,0.0005592592592592592,0.010666666666666668,0.009600000000000001,0.006095238095238095,0.0,0.0,0.0007619047619047619,0.0,0.0,0.0,0.010666666666666668,,,,,,0.0044444444444444444,1.0,5.0,3.0,2.0,calf,"calf, at farm {BR} Economic, U",Mecánico,milking system: Mecánico,ESPAC direct (gl_sistema_ordenio),,,66.0,1.5,450.0,2250.0,,,,,,,,,,,,,90.0,0.4,0.0,0.654642496106,100.0,0.0,0.079,0.0,90.0,0.0,0.0,10.0,,,12.0,10.8,10.8,0.0,0.0,1.2,0.0,0.0,0.0,0.0,12.0,,,,,,,,,,,5.0,100.0,mixed: direct ESPAC infrastructure + literature proxy water/electricity,infrastructure from ESPAC cattle milking-system field; water/electricity from literature proxy,"FAO small-scale dairy manual - Uses 4 to 6 L water per kg dry matter intake; the worked example for a 300 kg cow producing 10 kg milk/day gives about 66 L/day, adopted here as the dairy drinking-water proxy. (https://www.fao.org/4/t1265e/t1275e01.htm) | FAO Livestock housing water requirements - Reports dry dairy cow water requirements around 40 to 60 L/day, supporting the order of magnitude adopted for low-intensity tropical dairy systems. (https://www.fao.org/3/S1250E/S1250E12.htm) | Uruguay MGAP dairy intermediate-consumption report - Provides Latin American dairy infrastructure energy benchmarks for milking-room electricity and milk cooling; a rounded 1.5 kWh/cow/day proxy was adopted as a moderate regional milking-plus-cooling estimate. (https://www.gub.uy/ministerio-ganaderia-agricultura-pesca/sites/ministerio-ganaderia-agricultura-pesca/files/documentos/publicaciones/informe_consumo_intermedio.pdf)",1125.0,1125.0,0.0008888888888888889,"Animals_total_head multiplied by representative live weight, then converted to estimated meat output with the configured carcass-yield proxy.",kg meat (carcass-weight proxy),,as-fed kg/head/day,,"share-based, absolute kg/head/day estimated from configured intake assumption","pasture + supplement shares from ESPAC cattle module; pasture share split across linked cultivated pasture, linked natural pasture, and unmatched residual using holding-level ESPAC pasture areas",,,,
Sierra,COTOPAXI,cattle_live,cattle,dual-purpose,1 kg meat (carcass-weight proxy),1.0,0.0017499999999999998,2.0,0.8,0.3333333333333333,6.0,0.0673,0.8076,0.8076,0.0,0.0,0.0,0.0,0.0,0.04166666666666667,0.0,2.0,,,,,,,,,,,0.0003916666666666667,0.0,0.00086315752638,0.008333333333333333,0.007142857142857143,0.0026666666666666666,0.0,0.0,0.0005555555555555556,0.0,0.0,0.0,0.008084916666666667,,,,,,0.005,2.0,6.0,3.0,2.0,calf,"calf, at farm {BR} Economic, U",Mecánico,milking system: Mecánico,ESPAC direct (gl_sistema_ordenio),,,50.0,0.0,400.0,2400.0,,,,,,,,,,,,,95.0,0.4,0.0,0.8206288769965,100.0,0.0,0.064,0.0,90.0,0.0,0.0,10.0,,,10.0,9.5,9.0,0.0,0.0,1.0,0.0,0.0,0.0,0.0,10.0,,,,,,,,,,,6.0,100.0,mixed: direct ESPAC infrastructure + literature proxy water/electricity,infrastructure from ESPAC cattle milking-system field; water/electricity from literature proxy,FAO Livestock housing water requirements - Reports dry dairy cow water requirements around 40 to 60 L/day; the midpoint 50 L/day was adopted for dual-purpose cattle where milk intensity is lower than specialized dairy. (https://www.fao.org/3/S1250E/S1250E12.htm),1200.0,1200.0,0.0008333333333333334,"Animals_total_head multiplied by representative live weight, then converted to estimated meat output with the configured carcass-yield proxy.",kg meat (carcass-weight proxy),,as-fed kg/head/day,,"share-based, absolute kg/head/day estimated from configured intake assumption","pasture + supplement shares from ESPAC cattle module; pasture share split across linked cultivated pasture, linked natural pasture, and unmatched residual using holding-level ESPAC pasture areas",,,,
Sierra,COTOPAXI,donkey_live,asnal,(all holdings),1 kg live weight equivalent,1.0,0.011916666666666667,,,,1.0,,,0.0,0.0,0.0,0.0,0.0,0.0,0.1,0.0,1.0,,,,,,,,,,,,,,0.02,0.0,0.0,0.0,0.0,0.0,0.0,0.0,0.02,0.02,0.02,0.02,0.0,0.0,0.0,,2.15,1.0,,,,,,donkey holding with shelter and trough,literature/system proxy,,,18.0,0.0,180.0,180.0,,,,,,,,,,,,,0.0,,,,,,,,0.0,0.0,0.0,0.0,0.0,0.0,3.6,0.0,0.0,0.0,0.0,0.0,0.0,0.0,100.0,3.6,3.6,3.6,180.0,100.0,0.0,0.0,0.0,3.6,0.0,0.0,0.0,,,literature/system proxy,ESPAC livestock modules do not expose direct infrastructure/water/electricity variables for this row; literature/system proxy attached,WSU horse winter water note - Donkey water proxy was scaled from the horse baseline by representative body weight because no ESPAC or Ecuador-specific donkey water field was available. (https://s3.wp.wsu.edu/uploads/sites/2070/2024/01/1.24.pdf),180.0,180.0,0.005555555555555556,Animals_total_head multiplied by representative live weight to express kg live weight equivalent.,kg live weight equivalent,,dry-matter kg/head/day,dry-matter kg/head/day,no diet share data in ESPAC; literature proxy attached from config,no diet/ration fields found in other livestock module; literature proxy diet attached from inputs/02-05_espac_lci_coefficients.yml; main feed columns mapped from proxy diet components,donkey_live,Non-Ecuador fallback inference,"Derived as 2.0% of body weight in dry matter, using the midpoint of the 1.75% to 2.25% maintenance guideline for a representative 180 kg donkey.","Management recommendations for donkeys and mules - Ontario guidance gives 1.75% to 2.25% of body weight dry matter intake for maintenance in donkeys and mules; proxy uses the midpoint and a representative 180 kg body weight. (https://www.ontario.ca/page/management-recommendations-donkeys-and-mules) | Feeding Donkeys Straw and Hay Q and A with The Donkey Sanctuary - Reports research-based guidance that donkeys need about 1.5% of their body weight per day in dry feed, supporting a forage-first maintenance proxy. (https://www.thehaypillow.com/blogs/news/feeding-donkeys-straw-and-hay-q-a-with-the-donkey-sanctuary)"
