Costa,MANABÍ,milk,cattle,dual-purpose,1 kg FPCM,1.0,1.0175658112214756,18.501196567663197,101.75658112214757,,1.0,0.0376,0.6956449909441362,0.0,0.0,0.0,0.0,0.6956449909441362,0.0,1.7443985335225296,0.017443985335225298,18.501196567663197,1.0175658112214756,1.0,7.12296067855033,6.999999999999999,,,,,,,0.7990884458709823,0.0,0.8140526489771805,0.2907330889204216,0.046252991419157986,0.04162769227724219,0.0,0.0,0.0002441611113535453,0.0,0.0,0.0,0.046252991419157986,,,,,,1.0175658112214758,30.0,33.0,8.0,,dairy_cow,"dairy cow, at farm {BR} Economic, U",Mecánico,milking system: Mecánico,ESPAC direct (gl_sistema_ordenio),,,60.0,0.6,400.0,581.8181818181819,30.0,29.4821226,227.0,223.08139433999997,3.932300884955752,,,,,,,,90.0,21.8,0.0,21.985,100.0,0.0,0.75,0.0,90.0,0.0,0.0,10.0,,,10.0,1.6363636363636365,1.6363636363636365,0.0,0.0,0.18181818181818182,0.0,0.0,0.0,0.0,1.8181818181818181,,,,,,,,,,,30.5,100.0,mixed: direct ESPAC infrastructure + literature proxy water/electricity,infrastructure from ESPAC cattle milking-system field; water/electricity from literature proxy,FAO small-scale dairy manual - Lactating-cow water use increases with dry matter intake and milk output; a reduced 60 L/day proxy was retained for lower-intensity dual-purpose milk systems. (https://www.fao.org/4/t1265e/t1275e01.htm) | Uruguay MGAP dairy intermediate-consumption report - Latin American dairy energy benchmarks were scaled down to 0.6 kWh/head/day for lower-intensity dual-purpose milk handling. (https://www.gub.uy/ministerio-ganaderia-agricultura-pesca/sites/ministerio-ganaderia-agricultura-pesca/files/documentos/publicaciones/informe_consumo_intermedio.pdf),29.4821226,10760.974749,0.02907330889204216,Milk liters/day converted to kg FPCM using 0.982737 kg FPCM/L; live-weight-equivalent per kg FPCM is based on total herd live weight divided by total milk output; DFE annualizes this daily output by multiplying by 365.,kg FPCM/day,kg FPCM/7d,as-fed kg/head/day,,"share-based, absolute kg/head/day estimated from configured intake assumption","pasture + supplement shares from ESPAC cattle module; pasture share split across linked cultivated pasture, linked natural pasture, and unmatched residual using holding-level ESPAC pasture areas",,,,
Costa,MANABÍ,mule_live,mule,(all holdings),1 kg live weight equivalent,1.0,0.08571428571428572,,,,1.0,,,0.0,0.0,0.0,0.0,0.0,0.0,0.05,0.0,1.0,,,,,,,,,,,,,,0.01,0.0,0.0,0.0,0.0,0.0,0.0,0.0,0.01,0.01,0.01,0.01,0.0,0.0,0.0,,50.0,2.0,,,,,,mule holding with shelter and trough,literature/system proxy,,,35.0,0.0,350.0,700.0,,,,,,,,,,,,,0.0,,,,,,,,0.0,0.0,0.0,0.0,0.0,0.0,7.0,0.0,0.0,0.0,0.0,0.0,0.0,0.0,100.0,7.0,7.0,7.0,350.0,100.0,0.0,0.0,0.0,7.0,0.0,0.0,0.0,,,literature/system proxy,ESPAC livestock modules do not expose direct infrastructure/water/electricity variables for this row; literature/system proxy attached,WSU horse winter water note - Mule water proxy was scaled from the horse baseline by representative body weight because no ESPAC or Ecuador-specific mule water field was available. (https://s3.wp.wsu.edu/uploads/sites/2070/2024/01/1.24.pdf),700.0,700.0,0.0014285714285714286,Animals_total_head multiplied by representative live weight to express kg live weight equivalent.,kg live weight equivalent,,dry-matter kg/head/day,dry-matter kg/head/day,no diet share data in ESPAC; literature proxy attached from config,no diet/ration fields found in other livestock module; literature proxy diet attached from inputs/02-05_espac_lci_coefficients.yml; main feed columns mapped from proxy diet components,mule_live,Non-Ecuador fallback inference,"Derived as 2.0% of body weight in dry matter, using the midpoint of the 1.75% to 2.25% maintenance guideline for a representative 350 kg mule.",Management recommendations for donkeys and mules - Ontario guidance gives 1.75% to 2.25% of body weight dry matter intake for maintenance in donkeys and mules; proxy uses the midpoint and a representative 350 kg body weight. (https://www.ontario.ca/page/management-recommendations-donkeys-and-mules)
Costa,MANABÍ,swine_live,swine,(all swine),1 kg meat (carcass-weight proxy),1.0,0.1116575834108733,1.5151515151515151,,0.606060606060606,2.5,0.9372,3.5499999999999994,0.0,0.0,3.5499999999999994,0.0,0.0,0.0,0.03524544930898779,0.00031217397959389185,1.5151515151515151,,,,,,,,,,,,,,0.01258766046749564,0.0,0.0,0.0,0.0,0.011797155390136913,0.01887544862421906,0.005898577695068456,0.0,0.02359431078027383,,,,,,,22.5792,4.0,,2.0,piglet,"piglet, at farm {BR} Economic, U",,Ecuador smallholder pigsty or swine pen with feeder and drinker,literature/system proxy,,,7.0,0.062,75.23,300.92,,,,,,,,,,,,,0.0,,,,,,,,0.0,0.0,0.0,40.0,60.0,20.0,2.5,0.0,0.0,0.0,0.0,1.0,1.5,0.5,0.0,0.0,2.5,,,,,,,,,,,,,literature/system proxy,ESPAC livestock modules do not expose direct infrastructure/water/electricity variables for this row; literature/system proxy attached,"FAO Livestock housing for pigs - Pig water consumption varies by class from about 2.5 L/day at 25 kg to 7.0 L/day at 90 to 120 kg; 7.0 L/head/day was adopted as a practical market-pig proxy for mixed ESPAC swine rows. (https://www.fao.org/3/s1250e/S1250E14.htm) | Caracterización de granjas porcinas de Banasur, Pasaje, El Oro - Provides Ecuador smallholder swine-system context and supports the use of a simple pen-based infrastructure proxy, although it does not provide a clean biological drinking-water factor. (https://polodelconocimiento.com/ojs/index.php/es/article/view/1043/html) | National Hog Farmer study summary - Finishing-barn electricity around 11.2 kWh per finished pig produced was annualized over a 180-day finishing period to derive a daily proxy. (https://www.nationalhogfarmer.com/livestock-management/study-goes-to-pig-barns-to-find-actual-energy-use)",198.6072,198.6072,0.005035064186998256,"Animals_total_head multiplied by representative live weight, then converted to estimated meat output with the configured carcass-yield proxy.",kg meat (carcass-weight proxy),head,as-fed kg/head/day,,"share-based, absolute kg/head/day estimated from configured intake assumption",common feed + supplement + waste shares from ESPAC swine module,,,,
Costa,SANTA ELENA,cattle_live,cattle,(unknown),1 kg meat (carcass-weight proxy),1.0,0.002503125,2.0,1.1,0.4,5.0,0.0673,0.673,0.673,0.0,0.0,0.0,0.0,0.0,0.040625,0.0,2.0,,,,,,,,,,,0.005,0.0,0.005,0.008125,0.00625,0.01,0.0,0.00125,0.00375,0.0,0.0,0.0,0.008125,,,,,,0.005,2.505,6.5,3.5,1.0,calf,"calf, at farm {BR} Economic, U",,milking system: nan,ESPAC direct (gl_sistema_ordenio),,,50.0,0.0,400.0,2600.0,,,,,,,,,,,,,70.0,5.0,0.0,5.0,100.0,0.0,0.5,0.0,100.0,0.0,20.0,60.0,,,10.0,7.0,10.0,0.0,2.0,6.0,0.0,0.0,0.0,0.0,10.0,,,,,,,,,,,6.5,100.0,mixed: direct ESPAC infrastructure + literature proxy water/electricity,infrastructure from ESPAC cattle milking-system field; water/electricity from literature proxy,FAO Livestock housing water requirements - Reports dry dairy cow water requirements around 40 to 60 L/day; the midpoint 50 L/day was adopted when the cattle system is unspecified. (https://www.fao.org/3/S1250E/S1250E12.htm),1300.0,1300.0,0.0008125000000000001,"Animals_total_head multiplied by representative live weight, then converted to estimated meat output with the configured carcass-yield proxy.",kg meat (carcass-weight proxy),,as-fed kg/head/day,,"share-based, absolute kg/head/day estimated from configured intake assumption","pasture + supplement shares from ESPAC cattle module; pasture share split across linked cultivated pasture, linked natural pasture, and unmatched residual using holding-level ESPAC pasture areas",,,,
Costa,SANTA ELENA,cattle_live,cattle,beef,1 kg meat (carcass-weight proxy),1.0,0.005773809523809524,2.0,0.8,0.3333333333333333,6.0,0.0673,0.8076,0.8076,0.0,0.0,0.0,0.0,0.0,0.014583333333333334,0.0,2.0,,,,,,,,,,,0.0034161290322580647,0.0,0.0058665101588416665,0.002333333333333333,0.0018000000000000002,0.00023225806451612904,0.0,0.0,0.00017946666666666667,0.0,0.0,0.0,0.002333333333333333,,,,,,0.005,16.490000000000002,17.5,8.0,3.0,calf,"calf, at farm {BR} Economic, U",,milking system: nan,ESPAC direct (gl_sistema_ordenio),,,50.0,0.0,400.0,7000.0,,,,,,,,,,,,,90.0,4.5,0.0,16.55166152145,100.0,0.0,0.18181818181818182,0.0,90.0,0.0,0.0,10.0,,,8.0,7.2,7.2,0.0,0.0,0.8,0.0,0.0,0.0,0.0,8.0,,,,,,,,,,,15.0,100.0,mixed: direct ESPAC infrastructure + literature proxy water/electricity,infrastructure from ESPAC cattle milking-system field; water/electricity from literature proxy,FAO Livestock housing water requirements - Reports dry dairy cow water requirements around 40 to 60 L/day; the midpoint 50 L/day was adopted for beef cattle. (https://www.fao.org/3/S1250E/S1250E12.htm),3500.0,3500.0,0.00029166666666666664,"Animals_total_head multiplied by representative live weight, then converted to estimated meat output with the configured carcass-yield proxy.",kg meat (carcass-weight proxy),,as-fed kg/head/day,,"share-based, absolute kg/head/day estimated from configured intake assumption","pasture + supplement shares from ESPAC cattle module; pasture share split across linked cultivated pasture, linked natural pasture, and unmatched residual using holding-level ESPAC pasture areas",,,,
Costa,SANTA ELENA,cattle_live,cattle,dual-purpose,1 kg meat (carcass-weight proxy),1.0,0.006153846153846154,2.0,0.9615384615384616,0.26666666666666666,8.0,0.0673,1.0768,1.0768,0.0,0.0,0.0,0.0,0.0,0.03125,0.0,2.0,,,,,,,,,,,0.0,0.00098827480466375,0.0019444444444444444,0.00625,0.005625,0.0,0.002,0.0,0.0006490000000000001,0.0,0.0,0.0,0.0062499999999999995,,,,,,0.005,13.99,8.0,5.0,2.0,calf,"calf, at farm {BR} Economic, U",Mecánico,milking system: Mecánico,ESPAC direct (gl_sistema_ordenio),,,50.0,0.0,400.0,3200.0,,,,,,,,,,,,,90.0,0.0,0.838545065477,4.43677968993,0.0,100.0,0.0,0.04192725327385,0.0,90.0,0.0,10.0,,,10.0,9.0,0.0,9.0,0.0,1.0,0.0,0.0,0.0,0.0,10.0,,,,,,,,,,,8.0,100.0,mixed: direct ESPAC infrastructure + literature proxy water/electricity,infrastructure from ESPAC cattle milking-system field; water/electricity from literature proxy,FAO Livestock housing water requirements - Reports dry dairy cow water requirements around 40 to 60 L/day; the midpoint 50 L/day was adopted for dual-purpose cattle where milk intensity is lower than specialized dairy. (https://www.fao.org/3/S1250E/S1250E12.htm),1600.0,1600.0,0.000625,"Animals_total_head multiplied by representative live weight, then converted to estimated meat output with the configured carcass-yield proxy.",kg meat (carcass-weight proxy),,as-fed kg/head/day,,"share-based, absolute kg/head/day estimated from configured intake assumption","pasture + supplement shares from ESPAC cattle module; pasture share split across linked cultivated pasture, linked natural pasture, and unmatched residual using holding-level ESPAC pasture areas",,,,
Costa,SANTA ELENA,donkey_live,asnal,(all holdings),1 kg live weight equivalent,1.0,3.3333333333333335,,,,1.0,,,0.0,0.0,0.0,0.0,0.0,0.0,0.1,0.0,1.0,,,,,,,,,,,,,,0.02,0.0,0.0,0.0,0.0,0.0,0.0,0.0,0.02,0.02,0.02,0.02,0.0,0.0,0.0,,600.0,1.0,,,,,,donkey holding with shelter and trough,literature/system proxy,,,18.0,0.0,180.0,180.0,,,,,,,,,,,,,0.0,,,,,,,,0.0,0.0,0.0,0.0,0.0,0.0,3.6,0.0,0.0,0.0,0.0,0.0,0.0,0.0,100.0,3.6,3.6,3.6,180.0,100.0,0.0,0.0,0.0,3.6,0.0,0.0,0.0,,,literature/system proxy,ESPAC livestock modules do not expose direct infrastructure/water/electricity variables for this row; literature/system proxy attached,WSU horse winter water note - Donkey water proxy was scaled from the horse baseline by representative body weight because no ESPAC or Ecuador-specific donkey water field was available. (https://s3.wp.wsu.edu/uploads/sites/2070/2024/01/1.24.pdf),180.0,180.0,0.005555555555555556,Animals_total_head multiplied by representative live weight to express kg live weight equivalent.,kg live weight equivalent,,dry-matter kg/head/day,dry-matter kg/head/day,no diet share data in ESPAC; literature proxy attached from config,no diet/ration fields found in other livestock module; literature proxy diet attached from inputs/02-05_espac_lci_coefficients.yml; main feed columns mapped from proxy diet components,donkey_live,Non-Ecuador fallback inference,"Derived as 2.0% of body weight in dry matter, using the midpoint of the 1.75% to 2.25% maintenance guideline for a representative 180 kg donkey.","Management recommendations for donkeys and mules - Ontario guidance gives 1.75% to 2.25% of body weight dry matter intake for maintenance in donkeys and mules; proxy uses the midpoint and a representative 180 kg body weight. (https://www.ontario.ca/page/management-recommendations-donkeys-and-mules) | Feeding Donkeys Straw and Hay Q and A with The Donkey Sanctuary - Reports research-based guidance that donkeys need about 1.5% of their body weight per day in dry feed, supporting a forage-first maintenance proxy. (https://www.thehaypillow.com/blogs/news/feeding-donkeys-straw-and-hay-q-a-with-the-donkey-sanctuary)"
Costa,SANTA ELENA,eggs,chicken,layers,1 kg shell eggs,1.0,7.186168524563398e-07,0.025360977030743557,0.03804146554611534,,1.0,1.0,0.025360977030743557,0.0,0.0,0.0,0.0,0.0,0.025360977030743557,7.245194010542985e-07,3.296236914706493e-08,0.025360977030743557,,,,,0.3391729877205812,1.0,0.3391729877205812,1.0,,,,,,2.6435167335764943e-07,0.0,0.0,0.0,0.0,0.0,1.7623444890509962e-07,0.0,0.0,1.7623444890509962e-07,1.7623444890509962e-07,0.0,0.0,1.7623444890509962e-07,0.0,,0.22019139999999998,7699.0,7699.0,,laying_hen,"laying hen <17 weeks, at farm {RER} Economic, U",,non-cage layer house on deep litter with drinkers and lighting,literature/system proxy,0.286,0.22019139999999998,0.222,0.0101,1.514,7770.857333333333,,,,,,103926.0,306410.014248,103926.0,306410.014248,13.49863618651773,,,0.0,,,,,,,,0.0,0.0,0.0,0.0,99.99999999999999,0.0,0.081,0.0,0.0,0.0,0.0,0.0,0.054,0.0,0.0,0.0,0.054,0.054,,0.0,0.0,100.0,0.0,0.0,0.0,0.054,0.0,,,literature/system proxy,ESPAC livestock modules do not expose direct infrastructure/water/electricity variables for this row; literature/system proxy attached,"Producción sostenible en avicultura - Reports 222.03 L per 1000 hens per day, equivalent to 0.222 L/hen/day; used as the preferred Latin American-style layer water proxy. (https://dokumen.pub/produccion-sostenible-en-avicultura-l-6359269.html) | FAO small-scale poultry production - Reports that a laying hen can consume up to about 0.25 L/day of water, supporting the adopted 0.222 L/hen/day proxy. (https://www.fao.org/4/y4628e/y4628e03.htm) | Iowa layer-house electricity summary - Layer-house electricity around 10.1 kWh/day per 1000 birds was used, equivalent to 0.0101 kWh/bird/day. (https://blogs.millersville.edu/aest/2022/05/13/dr-haughery-publishes-research-findings/) | FAO small-scale poultry production - Intensive deep-litter housing is described for egg production with about 3 to 4 birds per m2; the midpoint 3.5 birds per m2 was retained, equivalent to 0.286 m2 per hen, as the non-cage layer-house footprint proxy. (https://www.fao.org/4/y5169e/y5169e02.htm)",306410.014248,306410.014248,3.263600905649993e-06,ESPAC egg counts are treated as weekly output and annualized with 52 periods/year before conversion to kg shell eggs using 0.056699 kg/egg; laying-hen live weight and feed are amortized over 1.50 producing years before normalization.,kg shell eggs/year,kg shell eggs/year,as-fed kg/head/day,as-fed kg/head/day,no diet share data in ESPAC; literature proxy attached from config,"no diet/ration fields found in avian module; literature proxy diet attached from inputs/02-05_espac_lci_coefficients.yml; main feed columns mapped from proxy diet as common compound feed, with no pasture or waste component",eggs,Ecuador direct,Semipasture or free-range scavenging was not quantified in the source; proxy covers balanced feed only.,Evaluación de parámetros productivos en crianza de gallinas criollas (gallina feliz). Patoa de Vallejo-Pujilí - Reports 0.081 ± 0.002 kg balanced feed per hen per day in a semipasture system in Cotopaxi. (https://repositorio.utc.edu.ec/handle/27000/7769)
Costa,SANTA ELENA,goat_live,caprine,(all holdings),1 kg meat (carcass-weight proxy),1.0,0.030718336483931942,2.1739130434782608,,,1.0,1.0,2.1739130434782608,0.0,0.0,0.0,2.1739130434782608,0.0,0.0,0.1721014492753623,0.0,2.1739130434782608,,,,,,,,,,,,,,0.018315217391304345,0.01831521739130435,0.0,0.0,0.01831521739130435,0.0,0.0,0.0,0.0,0.01831521739130435,0.018315217391304348,0.01447463768115942,0.0038405797101449275,0.0,0.0,,4.375,11.5,,,kid_goat,"kid goat, conventional, intensive forage area, at farm gate {FR} U",,grazing goat holding with shelter and trough,literature/system proxy,,,9.5,0.0,23.0,264.5,,,,,,,,,,,,,100.00000000000001,,,,,,,,0.0,0.0,100.00000000000001,0.0,0.0,0.0,1.011,1.0110000000000001,0.0,0.0,1.0110000000000001,0.0,0.0,0.0,0.0,0.0,1.0110000000000001,1.011,23.0,79.0,21.0,0.0,0.0,0.799,0.212,0.0,0.0,,,literature/system proxy,ESPAC livestock modules do not expose direct infrastructure/water/electricity variables for this row; literature/system proxy attached,FAO-linked livestock watering structures guideline - Reports ewe or doe water requirements around 9.5 L/day and milking ewe or doe requirements around 13.2 L/day; 9.5 L/head/day was adopted as a general goat live-animal proxy. (https://www.fao.org/fileadmin/user_upload/emergencies/docs/UNEP_FAO_South_Sudan_WH_Structures_guidelines.pdf),121.67000000000002,121.67000000000002,0.018115942028985504,"Animals_total_head multiplied by representative live weight, then converted to estimated meat output with the configured carcass-yield proxy.",kg meat (carcass-weight proxy),,dry-matter kg/head/day,dry-matter kg/head/day,no diet share data in ESPAC; literature proxy attached from config,"no diet/ration fields found in other livestock module; literature proxy diet attached from inputs/02-05_espac_lci_coefficients.yml; main feed columns mapped from proxy diet as unmatched pasture for forage plus browse, with mineral or compound feed retained separately",goat_live,Ecuador plus fallback composite,Composite proxy. Total intake is a fallback mature-doe dry matter intake example; tree-forage share is based on Ecuadorian caprine preference data and native browse literature from the Ecuadorian Sierra.,Evaluación de la preferencia de consumo de leguminosas arbóreas con potencial forrajero en rumiantes menores - Reports caprine Acacia melanoxylon voluntary intake of 211.07 g/kg MS and 20.155 g/kg PV^0.75 at 23 kg live weight. (https://repositorio.uta.edu.ec/items/770d67bf-97e2-485a-8227-d941b7f4e1b2) | Cabras Lecheras Selección y Hábitos de Consumo de Plantas Nativas en la Sierra Ecuatoriana - Ecuador review identifying native browse and shrub resources as a central component of dairy goat feeding in the Sierra. (https://polodelconocimiento.com/ojs/index.php/es/article/download/7592/pdf) | Goat Nutrition - Provides a mature-doe dry matter intake example of about 1.011 kg/day (2.23 lb/day) used as fallback total intake. (https://sfyl.ifas.ufl.edu/duval/agriculture-and-agribusiness-management/livestock-and-poultry/goats/goat-nutrition/)
Costa,SANTA ELENA,horse_live,equine,(all holdings),1 kg live weight equivalent,1.0,0.09455128205128205,,,,1.0,,,0.0,0.0,0.0,0.0,0.0,0.0,0.07211538461538461,0.0,1.0,,,,,,,,,,,,,,0.010817307692307692,0.0,0.0,0.0,0.0,0.0,0.0,0.0,0.010817307692307692,0.010817307692307692,0.010817307692307692,0.010817307692307692,0.0,0.0,0.0,,71.21000000000001,2.0,,,,,,"horse holding with shelter, trough, and simple handling area",literature/system proxy,,,45.0,0.0,312.0,624.0,,,,,,,,,,,,,0.0,,,,,,,,0.0,0.0,0.0,0.0,0.0,0.0,6.75,0.0,0.0,0.0,0.0,0.0,0.0,0.0,100.0,6.75,6.75,6.75,312.0,100.0,0.0,0.0,0.0,6.75,0.0,0.0,0.0,,,literature/system proxy,ESPAC livestock modules do not expose direct infrastructure/water/electricity variables for this row; literature/system proxy attached,WSU horse winter water note - Horses need at least 10 to 12 gallons/day; a rounded 45 L/day proxy was adopted. (https://s3.wp.wsu.edu/uploads/sites/2070/2024/01/1.24.pdf),624.0,624.0,0.0016025641025641025,Animals_total_head multiplied by representative live weight to express kg live weight equivalent.,kg live weight equivalent,,dry-matter kg/head/day,dry-matter kg/head/day,no diet share data in ESPAC; literature proxy attached from config,no diet/ration fields found in other livestock module; literature proxy diet attached from inputs/02-05_espac_lci_coefficients.yml; main feed columns mapped from proxy diet components,horse_live,Non-Ecuador fallback inference,Derived as 1.5% of body weight in forage dry matter for a representative Ecuadorian criollo horse at the midpoint of the reported 290 to 334 kg live-weight range.,Caracterización cromohipológica y zoométrica de caballos criollos - Reports an approximate live-weight range of 290 to 334 kg for the evaluated Ecuadorian criollo horse population; the midpoint was used as the representative horse live weight. (https://redi.cedia.edu.ec/document/74588) | Understanding Hay Quality Even Good Hay Can Have Bad Things In It - AAEP guidance indicates horses should receive about 1 to 1.5% of body weight in forage; proxy uses the upper end and the Ecuadorian criollo horse weight midpoint adopted above. (https://aaep.org/post/understanding-hay-quality-even-good-hay-can-have-bad-things-in-it/)
Costa,SANTA ELENA,milk,cattle,(unknown),1 kg FPCM,,,,,,1.0,0.0376,,0.0,0.0,0.0,0.0,,0.0,,,,,,,,,,,,,,,,,,,,,,,,,,,,,,,,,2.505,6.5,3.5,,dairy_cow,"dairy cow, at farm {BR} Economic, U",,milking system: nan,ESPAC direct (gl_sistema_ordenio),,,60.0,0.6,400.0,254.54545454545456,,,,,,,,,,,,,70.0,5.0,0.0,5.0,100.0,0.0,0.5,0.0,100.0,0.0,20.0,60.0,,,10.0,1.2727272727272727,1.8181818181818181,0.0,0.36363636363636365,1.0909090909090908,0.0,0.0,0.0,0.0,1.8181818181818181,,,,,,,,,,,6.5,100.0,mixed: direct ESPAC infrastructure + literature proxy water/electricity,infrastructure from ESPAC cattle milking-system field; water/electricity from literature proxy,FAO small-scale dairy manual - Lactating-cow water use increases with dry matter intake and milk output; a reduced 60 L/day proxy was retained for milk rows with unspecified system. (https://www.fao.org/4/t1265e/t1275e01.htm) | Uruguay MGAP dairy intermediate-consumption report - Latin American dairy energy benchmarks were scaled to 0.6 kWh/head/day for milk rows with unspecified system. (https://www.gub.uy/ministerio-ganaderia-agricultura-pesca/sites/ministerio-ganaderia-agricultura-pesca/files/documentos/publicaciones/informe_consumo_intermedio.pdf),,,,Milk liters/day converted to kg FPCM using 0.982737 kg FPCM/L; live-weight-equivalent per kg FPCM is based on total herd live weight divided by total milk output; DFE annualizes this daily output by multiplying by 365.,kg FPCM/day,kg FPCM/7d,as-fed kg/head/day,,"share-based, absolute kg/head/day estimated from configured intake assumption","pasture + supplement shares from ESPAC cattle module; pasture share split across linked cultivated pasture, linked natural pasture, and unmatched residual using holding-level ESPAC pasture areas",,,,
Costa,SANTA ELENA,milk,cattle,beef,1 kg FPCM,,,,,,1.0,0.0376,,0.0,0.0,0.0,0.0,,0.0,,,,,,,,,,,,,,,,,,,,,,,,,,,,,,,,,16.490000000000002,17.5,7.0,,dairy_cow,"dairy cow, at farm {BR} Economic, U",,milking system: nan,ESPAC direct (gl_sistema_ordenio),,,60.0,0.3,400.0,509.0909090909091,,,,,,,,,,,,,90.0,7.5,0.0,16.55166152145,100.0,0.0,0.38181818181818183,0.0,90.0,0.0,0.0,10.0,,,8.0,1.309090909090909,1.309090909090909,0.0,0.0,0.14545454545454548,0.0,0.0,0.0,0.0,1.4545454545454546,,,,,,,,,,,15.0,100.0,mixed: direct ESPAC infrastructure + literature proxy water/electricity,infrastructure from ESPAC cattle milking-system field; water/electricity from literature proxy,FAO small-scale dairy manual - Lactating-cow water use increases with dry matter intake and milk output; a reduced 60 L/day proxy was retained for low-intensity milk output in non-dairy systems. (https://www.fao.org/4/t1265e/t1275e01.htm) | Uruguay MGAP dairy intermediate-consumption report - Latin American dairy energy benchmarks were strongly downscaled to 0.3 kWh/head/day for occasional milk handling in beef-oriented systems. (https://www.gub.uy/ministerio-ganaderia-agricultura-pesca/sites/ministerio-ganaderia-agricultura-pesca/files/documentos/publicaciones/informe_consumo_intermedio.pdf),,,,Milk liters/day converted to kg FPCM using 0.982737 kg FPCM/L; live-weight-equivalent per kg FPCM is based on total herd live weight divided by total milk output; DFE annualizes this daily output by multiplying by 365.,kg FPCM/day,kg FPCM/7d,as-fed kg/head/day,,"share-based, absolute kg/head/day estimated from configured intake assumption","pasture + supplement shares from ESPAC cattle module; pasture share split across linked cultivated pasture, linked natural pasture, and unmatched residual using holding-level ESPAC pasture areas",,,,
