Sierra,(all provinces confounded),horse_live,equine,1 kg live weight equivalent,1.0,0.023205128205128205,,,,1.0,,,0.0,0.0,0.0,0.0,0.0,0.0,0.14423076923076922,0.0,1.0,,,,,,,,,,,,,,0.021634615384615384,0.0,0.0,0.0,0.0,0.0,0.0,0.0,0.021634615384615384,0.021634615384615384,0.021634615384615384,0.021634615384615384,0.0,0.0,0.0,,12.0,1.0,,,,,,"horse holding with shelter, trough, and simple handling area",literature/system proxy,,,45.0,0.0,312.0,312.0,,,,,,,,,,,,,0.0,,,,,,,,0.0,0.0,0.0,0.0,0.0,0.0,6.75,0.0,0.0,0.0,0.0,0.0,0.0,0.0,100.0,6.75,6.75,6.75,312.0,100.0,0.0,0.0,0.0,6.75,0.0,0.0,0.0,,,literature/system proxy,ESPAC livestock modules do not expose direct infrastructure/water/electricity variables for this row; literature/system proxy attached,WSU horse winter water note - Horses need at least 10 to 12 gallons/day; a rounded 45 L/day proxy was adopted. (https://s3.wp.wsu.edu/uploads/sites/2070/2024/01/1.24.pdf),312.0,312.0,0.003205128205128205,Animals_total_head multiplied by representative live weight to express kg live weight equivalent.,kg live weight equivalent,,dry-matter kg/head/day,dry-matter kg/head/day,no diet share data in ESPAC; literature proxy attached from config,no diet/ration fields found in other livestock module; literature proxy diet attached from inputs/02-05_espac_lci_coefficients.yml; main feed columns mapped from proxy diet components,horse_live,Non-Ecuador fallback inference,Derived as 1.5% of body weight in forage dry matter for a representative Ecuadorian criollo horse at the midpoint of the reported 290 to 334 kg live-weight range.,Caracterización cromohipológica y zoométrica de caballos criollos - Reports an approximate live-weight range of 290 to 334 kg for the evaluated Ecuadorian criollo horse population; the midpoint was used as the representative horse live weight. (https://redi.cedia.edu.ec/document/74588) | Understanding Hay Quality Even Good Hay Can Have Bad Things In It - AAEP guidance indicates horses should receive about 1 to 1.5% of body weight in forage; proxy uses the upper end and the Ecuadorian criollo horse weight midpoint adopted above. (https://aaep.org/post/understanding-hay-quality-even-good-hay-can-have-bad-things-in-it/)
Sierra,(all provinces confounded),meat_poultry,chicken,1 kg meat (carcass-weight proxy),1.0,6e-06,1.3333333333333333,,0.0,1.0,1.0,1.3333333333333333,0.0,1.3333333333333333,0.0,0.0,0.0,0.0,4.990740740740742e-06,9.074074074074073e-08,1.3333333333333333,,,,,,,,,0.0,,,,,1.2340740740740742e-06,0.0,0.0,0.0,0.0,0.0,1.2340740740740742e-06,0.0,0.0,1.2340740740740742e-06,1.2340740740740742e-06,0.0,0.0,1.2340740740740742e-06,0.0,,0.33075,36750.0,,0.0,one_day_chicken,"one-day-chicken, at farm {BR} Economic, U",,broiler house or coop for meat birds,literature/system proxy,0.09,0.33075,0.275,0.005,2.0,73500.0,,,,,,,,,,,0.0,,0.0,,,,,,,,0.0,0.0,0.0,0.0,100.0,0.0,0.068,0.0,0.0,0.0,0.0,0.0,0.068,0.0,0.0,0.0,0.068,0.068,2.0,0.0,0.0,100.0,0.0,0.0,0.0,0.068,0.0,,,literature/system proxy,ESPAC livestock modules do not expose direct infrastructure/water/electricity variables for this row; literature/system proxy attached,"FAO Rural structures in the tropics - Table 10.15 reports broiler drinking-water requirements around 0.20 to 0.35 L/bird/day at 9 to 12 weeks; the midpoint 0.275 L/bird/day was adopted. (https://www.fao.org/4/s1250e/S1250E0q.htm) | Iowa layer-house electricity summary - In the absence of a stronger broiler electricity factor in ESPAC, a conservative small-poultry-house electricity proxy of 0.005 kWh/bird/day was retained. (https://blogs.millersville.edu/aest/2022/05/13/dr-haughery-publishes-research-findings/) | FAO Good practices for the small-scale production of broiler chickens - Reports that under tropical conditions about 900 cm2 per broiler is sufficient for a 1.65 kg bird in the deep-litter system, described there as the most widely used broiler housing system; this was retained as a dominant broiler-house area proxy for Ecuador. (https://www.fao.org/4/y4991e/y4991e00.pdf)",55125.0,55125.0,1.8148148148148147e-05,"Animals_total_head multiplied by representative live weight, then converted to estimated meat output with the configured carcass-yield proxy.",kg meat (carcass-weight proxy),head,as-fed kg/head/day,as-fed kg/head/day,no diet share data in ESPAC; literature proxy attached from config,"no diet/ration fields found in avian module; literature proxy diet attached from inputs/02-05_espac_lci_coefficients.yml; main feed columns mapped from proxy diet as common compound feed, with no pasture or waste component",meat_poultry,FAO direct,"Broiler feed proxy based on FAO cumulative feed demand of 4 to 6 kg per bird to reach 2 kg live weight by 9 to 12 weeks, converted to an average daily intake.",FAO Rural structures in the tropics - Reports that one broiler grown from day-old chick to 2 kg live weight at 9 to 12 weeks requires 4 to 6 kg feed; the midpoint was annualized to about 0.068 kg/bird/day. (https://www.fao.org/4/s1250e/S1250E0q.htm)
Sierra,(all provinces confounded),milk,cattle,1 kg FPCM,1.0,0.1582880150788962,13.875897425747393,76.31743584161067,,1.0,0.0376,0.521733743208102,0.0,0.0,0.0,0.0,0.521733743208102,0.0,4.197458971288587,0.07631743584161067,13.875897425747393,1.0175658112214756,1.0,6.893680828382402,6.774678111587983,,,,,,,0.03529392326478124,0.0,0.06783772074809838,0.7631743584161067,0.11753701348868383,0.05708940655164643,0.0,0.0,0.0004637633272960908,0.0,0.0,0.0,0.11740612659218161,,,,,,0.38158717920805335,3.0,7.0,3.0,,dairy_cow,"dairy cow, at farm {BR} Economic, U",Mecánico,milking system: Mecánico,ESPAC direct (gl_sistema_ordenio),,,66.0,1.5,450.0,218.1818181818182,15.0,14.7410613,134.0,131.68681428,6.0,,,,,,,,90.0,0.6,0.0,1.2,100.0,0.0,0.08285714285714285,0.0,80.0,0.0,0.0,10.0,,,12.0,1.8,1.6363636363636365,0.0,0.0,0.21818181818181817,0.0,0.0,0.0,0.0,2.1818181818181817,,,,,,,,,,,7.0,100.0,mixed: direct ESPAC infrastructure + literature proxy water/electricity,infrastructure from ESPAC cattle milking-system field; water/electricity from literature proxy,"FAO small-scale dairy manual - Uses 4 to 6 L water per kg dry matter intake; the worked example for a 300 kg cow producing 10 kg milk/day gives about 66 L/day, adopted here as the milk-row water proxy. (https://www.fao.org/4/t1265e/t1275e01.htm) | FAO Milking, milk collection and transport - Gives wash-water benchmarks for hand, bucket, and pipeline milking plus plate-cooler water loads, supporting a dedicated dairy handling infrastructure proxy. (https://www.fao.org/4/i2433e/i2433e07.pdf) | Uruguay MGAP dairy intermediate-consumption report - Provides Latin American dairy infrastructure energy benchmarks for milking-room electricity and milk cooling; a rounded 1.5 kWh/cow/day proxy was adopted as a moderate regional milking-plus-cooling estimate. (https://www.gub.uy/ministerio-ganaderia-agricultura-pesca/sites/ministerio-ganaderia-agricultura-pesca/files/documentos/publicaciones/informe_consumo_intermedio.pdf)",14.7410613,5380.4873745,0.06783772074809838,Milk liters/day converted to kg FPCM using 0.982737 kg FPCM/L; live-weight-equivalent per kg FPCM is based on total herd live weight divided by total milk output; DFE annualizes this daily output by multiplying by 365.,kg FPCM/day,kg FPCM/7d,as-fed kg/head/day,,"share-based, absolute kg/head/day estimated from configured intake assumption","pasture + supplement shares from ESPAC cattle module; pasture share split across linked cultivated pasture, linked natural pasture, and unmatched residual using holding-level ESPAC pasture areas",,,,
Sierra,(all provinces confounded),mule_live,mule,1 kg live weight equivalent,1.0,0.03591428571428572,,,,1.0,,,0.0,0.0,0.0,0.0,0.0,0.0,0.1,0.0,1.0,,,,,,,,,,,,,,0.02,0.0,0.0,0.0,0.0,0.0,0.0,0.0,0.02,0.02,0.02,0.02,0.0,0.0,0.0,,15.024999999999999,1.0,,,,,,mule holding with shelter and trough,literature/system proxy,,,35.0,0.0,350.0,350.0,,,,,,,,,,,,,0.0,,,,,,,,0.0,0.0,0.0,0.0,0.0,0.0,7.0,0.0,0.0,0.0,0.0,0.0,0.0,0.0,100.0,7.0,7.0,7.0,350.0,100.0,0.0,0.0,0.0,7.0,0.0,0.0,0.0,,,literature/system proxy,ESPAC livestock modules do not expose direct infrastructure/water/electricity variables for this row; literature/system proxy attached,WSU horse winter water note - Mule water proxy was scaled from the horse baseline by representative body weight because no ESPAC or Ecuador-specific mule water field was available. (https://s3.wp.wsu.edu/uploads/sites/2070/2024/01/1.24.pdf),350.0,350.0,0.002857142857142857,Animals_total_head multiplied by representative live weight to express kg live weight equivalent.,kg live weight equivalent,,dry-matter kg/head/day,dry-matter kg/head/day,no diet share data in ESPAC; literature proxy attached from config,no diet/ration fields found in other livestock module; literature proxy diet attached from inputs/02-05_espac_lci_coefficients.yml; main feed columns mapped from proxy diet components,mule_live,Non-Ecuador fallback inference,"Derived as 2.0% of body weight in dry matter, using the midpoint of the 1.75% to 2.25% maintenance guideline for a representative 350 kg mule.",Management recommendations for donkeys and mules - Ontario guidance gives 1.75% to 2.25% of body weight dry matter intake for maintenance in donkeys and mules; proxy uses the midpoint and a representative 350 kg body weight. (https://www.ontario.ca/page/management-recommendations-donkeys-and-mules)
Sierra,(all provinces confounded),ovine_live,ovine,1 kg meat (carcass-weight proxy),1.0,0.011329957126003511,2.1739130434782608,,1.0869565217391304,2.0,1.0,4.3478260869565215,0.0,0.0,0.0,4.3478260869565215,0.0,0.0,0.06833942393462435,0.0,2.1739130434782608,,,,,,,,,,,,,,0.011437861479584498,0.011392901332259085,0.0,0.0,0.011392901332259085,8.992029465082152e-05,0.0,0.0,2.0746250530971727e-18,0.011482821626909908,0.011437861479584498,0.008938077288291659,0.0024548240439674278,0.0,4.496014732541076e-05,,1.37,4.0,,2.0,kid_goat,"kid goat, conventional, intensive forage area, at farm gate {FR} U",,grazing ovine holding with shelter and trough,literature/system proxy,,,7.6,0.0,60.44,241.76,,,,,,,,,,,,,99.6069182389937,,,,,,,,0.0,0.0,99.6069182389937,0.3930817610062893,0.0,0.0,1.272,1.267,0.0,0.0,1.267,0.005,0.0,0.0,9.069112511985665e-15,1.1535911115245767e-16,1.272,1.272,60.44,78.1,21.5,0.0,0.4,0.994,0.273,0.0,0.005,,,literature/system proxy,ESPAC livestock modules do not expose direct infrastructure/water/electricity variables for this row; literature/system proxy attached,FAO-linked livestock watering structures guideline - Reports feeder lamb and kid water requirements around 7.6 L/day and adult ewe or doe requirements above that level; 7.6 L/head/day was retained as a conservative live-animal proxy for mixed ovine rows. (https://www.fao.org/fileadmin/user_upload/emergencies/docs/UNEP_FAO_South_Sudan_WH_Structures_guidelines.pdf),111.2096,111.2096,0.008992029465082152,"Animals_total_head multiplied by representative live weight, then converted to estimated meat output with the configured carcass-yield proxy.",kg meat (carcass-weight proxy),head,dry-matter kg/head/day,dry-matter kg/head/day,no diet share data in ESPAC; literature proxy attached from config,"no diet/ration fields found in ovine module; literature proxy diet attached from inputs/02-05_espac_lci_coefficients.yml; main feed columns mapped from proxy diet as unmatched pasture for forage plus browse, with mineral or compound feed retained separately",ovine_live,Ecuador composite,Composite Ecuador proxy. Total intake is based on an ovine feeding trial; tree-forage share comes from Acacia mearnsii voluntary intake; mineral intake comes from a Blackbelly sheep grazing study in the Ecuadorian Amazon.,UTA thesis by Erika Esthefanía Lluay Guilcapi (bitstream 32507) - Reports voluntary dry matter intake of 1268.85 g/day in weaned sheep in Ecuador. (https://repositorio.uta.edu.ec/bitstream/123456789/32507/1/Tesis%20182%20Medicina%20Veterinaria%20y%20Zootecnia%20-Lluay%20Guilcapi%20Erika%20Esthefan%C3%ADa.pdf) | Evaluación de la preferencia de consumo de leguminosas arbóreas con potencial forrajero en rumiantes menores - Reports ovine Acacia mearnssi voluntary intake of 272.50 g/kg MS and 12.60 g/kg PV^0.75 at 60.44 kg live weight. (https://repositorio.uta.edu.ec/items/770d67bf-97e2-485a-8227-d941b7f4e1b2) | Effect of Mineral Supplementation on the Macromineral Concentration in Blood in Pre- and Postpartum Blackbelly Sheep - Reports 0.005 kg per animal per day mineral supplementation under free-grazing conditions in the Ecuadorian Amazon. (https://pmc.ncbi.nlm.nih.gov/articles/PMC7401505/)
Sierra,(all provinces confounded),swine_live,swine,1 kg meat (carcass-weight proxy),1.0,0.019737451613033162,1.5151515151515154,,1.5151515151515154,1.0,0.9372,1.4200000000000002,0.0,0.0,1.4200000000000002,0.0,0.0,0.0,0.07049089861797558,0.0006243479591877837,1.5151515151515154,,,,,,,,,,,,,,0.02517532093499128,0.0,0.0,0.0,0.0,0.005898577695068456,0.011797155390136913,0.01887544862421906,0.0,0.023594310780273825,,,,,,,1.87,2.0,,2.0,piglet,"piglet, at farm {BR} Economic, U",,Ecuador smallholder pigsty or swine pen with feeder and drinker,literature/system proxy,,,7.0,0.062,75.23,150.46,,,,,,,,,,,,,0.0,,,,,,,,0.0,0.0,0.0,20.0,50.0,80.0,2.5,0.0,0.0,0.0,0.0,0.5,1.25,2.0,0.0,0.0,2.5,,,,,,,,,,,,,literature/system proxy,ESPAC livestock modules do not expose direct infrastructure/water/electricity variables for this row; literature/system proxy attached,"FAO Livestock housing for pigs - Pig water consumption varies by class from about 2.5 L/day at 25 kg to 7.0 L/day at 90 to 120 kg; 7.0 L/head/day was adopted as a practical market-pig proxy for mixed ESPAC swine rows. (https://www.fao.org/3/s1250e/S1250E14.htm) | Caracterización de granjas porcinas de Banasur, Pasaje, El Oro - Provides Ecuador smallholder swine-system context and supports the use of a simple pen-based infrastructure proxy, although it does not provide a clean biological drinking-water factor. (https://polodelconocimiento.com/ojs/index.php/es/article/view/1043/html) | National Hog Farmer study summary - Finishing-barn electricity around 11.2 kWh per finished pig produced was annualized over a 180-day finishing period to derive a daily proxy. (https://www.nationalhogfarmer.com/livestock-management/study-goes-to-pig-barns-to-find-actual-energy-use)",99.3036,99.3036,0.010070128373996512,"Animals_total_head multiplied by representative live weight, then converted to estimated meat output with the configured carcass-yield proxy.",kg meat (carcass-weight proxy),head,as-fed kg/head/day,,"share-based, absolute kg/head/day estimated from configured intake assumption",common feed + supplement + waste shares from ESPAC swine module,,,,
