Oriente,(all provinces confounded),goat_live,caprine,1 kg meat (carcass-weight proxy),1.0,2.955103969754253,2.1739130434782608,,,1.0,1.0,2.1739130434782608,0.0,0.0,0.0,2.1739130434782608,0.0,0.0,0.5986137366099559,0.0,2.1739130434782608,,,,,,,,,,,,,,0.06370510396975425,0.06370510396975426,0.0,0.0,0.06370510396975426,0.0,0.0,0.0,0.0,0.06370510396975426,0.06370510396975426,0.05034656584751103,0.013358538122243226,0.0,0.0,,31.765,2.0,,,kid_goat,"kid goat, conventional, intensive forage area, at farm gate {FR} U",,grazing goat holding with shelter and trough,literature/system proxy,,,9.5,0.0,23.0,46.0,,,,,,,,,,,,,100.00000000000001,,,,,,,,0.0,0.0,100.00000000000001,0.0,0.0,0.0,1.011,1.0110000000000001,0.0,0.0,1.0110000000000001,0.0,0.0,0.0,0.0,0.0,1.0110000000000001,1.011,23.0,79.0,21.0,0.0,0.0,0.799,0.212,0.0,0.0,,,literature/system proxy,ESPAC livestock modules do not expose direct infrastructure/water/electricity variables for this row; literature/system proxy attached,FAO-linked livestock watering structures guideline - Reports ewe or doe water requirements around 9.5 L/day and milking ewe or doe requirements around 13.2 L/day; 9.5 L/head/day was adopted as a general goat live-animal proxy. (https://www.fao.org/fileadmin/user_upload/emergencies/docs/UNEP_FAO_South_Sudan_WH_Structures_guidelines.pdf),21.16,21.16,0.0630119722747322,"Animals_total_head multiplied by representative live weight, then converted to estimated meat output with the configured carcass-yield proxy.",kg meat (carcass-weight proxy),,dry-matter kg/head/day,dry-matter kg/head/day,no diet share data in ESPAC; literature proxy attached from config,"no diet/ration fields found in other livestock module; literature proxy diet attached from inputs/02-05_espac_lci_coefficients.yml; main feed columns mapped from proxy diet as unmatched pasture for forage plus browse, with mineral or compound feed retained separately",goat_live,Ecuador plus fallback composite,Composite proxy. Total intake is a fallback mature-doe dry matter intake example; tree-forage share is based on Ecuadorian caprine preference data and native browse literature from the Ecuadorian Sierra.,Evaluación de la preferencia de consumo de leguminosas arbóreas con potencial forrajero en rumiantes menores - Reports caprine Acacia melanoxylon voluntary intake of 211.07 g/kg MS and 20.155 g/kg PV^0.75 at 23 kg live weight. (https://repositorio.uta.edu.ec/items/770d67bf-97e2-485a-8227-d941b7f4e1b2) | Cabras Lecheras Selección y Hábitos de Consumo de Plantas Nativas en la Sierra Ecuatoriana - Ecuador review identifying native browse and shrub resources as a central component of dairy goat feeding in the Sierra. (https://polodelconocimiento.com/ojs/index.php/es/article/download/7592/pdf) | Goat Nutrition - Provides a mature-doe dry matter intake example of about 1.011 kg/day (2.23 lb/day) used as fallback total intake. (https://sfyl.ifas.ufl.edu/duval/agriculture-and-agribusiness-management/livestock-and-poultry/goats/goat-nutrition/)
Oriente,(all provinces confounded),horse_live,equine,1 kg live weight equivalent,1.0,0.07767094017094019,,,,1.0,,,0.0,0.0,0.0,0.0,0.0,0.0,0.14423076923076922,0.0,1.0,,,,,,,,,,,,,,0.021634615384615384,0.0,0.0,0.0,0.0,0.0,0.0,0.0,0.021634615384615384,0.021634615384615384,0.021634615384615384,0.021634615384615384,0.0,0.0,0.0,,40.03,1.0,,,,,,"horse holding with shelter, trough, and simple handling area",literature/system proxy,,,45.0,0.0,312.0,312.0,,,,,,,,,,,,,0.0,,,,,,,,0.0,0.0,0.0,0.0,0.0,0.0,6.75,0.0,0.0,0.0,0.0,0.0,0.0,0.0,100.0,6.75,6.75,6.75,312.0,100.0,0.0,0.0,0.0,6.75,0.0,0.0,0.0,,,literature/system proxy,ESPAC livestock modules do not expose direct infrastructure/water/electricity variables for this row; literature/system proxy attached,WSU horse winter water note - Horses need at least 10 to 12 gallons/day; a rounded 45 L/day proxy was adopted. (https://s3.wp.wsu.edu/uploads/sites/2070/2024/01/1.24.pdf),312.0,312.0,0.003205128205128205,Animals_total_head multiplied by representative live weight to express kg live weight equivalent.,kg live weight equivalent,,dry-matter kg/head/day,dry-matter kg/head/day,no diet share data in ESPAC; literature proxy attached from config,no diet/ration fields found in other livestock module; literature proxy diet attached from inputs/02-05_espac_lci_coefficients.yml; main feed columns mapped from proxy diet components,horse_live,Non-Ecuador fallback inference,Derived as 1.5% of body weight in forage dry matter for a representative Ecuadorian criollo horse at the midpoint of the reported 290 to 334 kg live-weight range.,Caracterización cromohipológica y zoométrica de caballos criollos - Reports an approximate live-weight range of 290 to 334 kg for the evaluated Ecuadorian criollo horse population; the midpoint was used as the representative horse live weight. (https://redi.cedia.edu.ec/document/74588) | Understanding Hay Quality Even Good Hay Can Have Bad Things In It - AAEP guidance indicates horses should receive about 1 to 1.5% of body weight in forage; proxy uses the upper end and the Ecuadorian criollo horse weight midpoint adopted above. (https://aaep.org/post/understanding-hay-quality-even-good-hay-can-have-bad-things-in-it/)
Oriente,(all provinces confounded),milk,cattle,1 kg FPCM,1.0,1.0989710761191938,18.501196567663193,101.75658112214757,,1.0,0.0376,0.6956449909441361,0.0,0.0,0.0,0.0,0.6956449909441361,0.0,3.35796717703087,0.038158717920805336,18.501196567663193,1.0175658112214756,1.0,7.12296067855033,6.999999999999999,,,,,,,0.6359786320134222,0.0,0.6359786320134222,0.5653143395674864,0.08880574352478333,0.08325538455448438,0.0,0.0,0.00027825799637765444,0.0,0.0,0.0,0.0896405175139163,,,,,,1.0175658112214756,20.0,17.0,4.0,,dairy_cow,"dairy cow, at farm {BR} Economic, U",Mecánico,milking system: Mecánico,ESPAC direct (gl_sistema_ordenio),,,60.0,0.6,400.0,327.27272727272725,18.0,17.68927356,209.0,205.39212078,4.0,,,,,,,,95.0,10.0,0.0,10.0,100.0,0.0,0.625,0.0,90.86137373263439,0.0,0.0,10.0,,,10.0,1.6363636363636365,1.5272727272727273,0.0,0.0,0.14545454545454548,0.0,0.0,0.0,0.0,1.8181818181818181,,,,,,,,,,,18.0,100.0,mixed: direct ESPAC infrastructure + literature proxy water/electricity,infrastructure from ESPAC cattle milking-system field; water/electricity from literature proxy,FAO small-scale dairy manual - Lactating-cow water use increases with dry matter intake and milk output; a reduced 60 L/day proxy was retained for lower-intensity dual-purpose milk systems. (https://www.fao.org/4/t1265e/t1275e01.htm) | Uruguay MGAP dairy intermediate-consumption report - Latin American dairy energy benchmarks were scaled down to 0.6 kWh/head/day for lower-intensity dual-purpose milk handling. (https://www.gub.uy/ministerio-ganaderia-agricultura-pesca/sites/ministerio-ganaderia-agricultura-pesca/files/documentos/publicaciones/informe_consumo_intermedio.pdf),17.68927356,6456.5848494,0.050878290561073784,Milk liters/day converted to kg FPCM using 0.982737 kg FPCM/L; live-weight-equivalent per kg FPCM is based on total herd live weight divided by total milk output; DFE annualizes this daily output by multiplying by 365.,kg FPCM/day,kg FPCM/7d,as-fed kg/head/day,,"share-based, absolute kg/head/day estimated from configured intake assumption","pasture + supplement shares from ESPAC cattle module; pasture share split across linked cultivated pasture, linked natural pasture, and unmatched residual using holding-level ESPAC pasture areas",,,,
Oriente,(all provinces confounded),mule_live,mule,1 kg live weight equivalent,1.0,0.1,,,,1.0,,,0.0,0.0,0.0,0.0,0.0,0.0,0.1,0.0,1.0,,,,,,,,,,,,,,0.02,0.0,0.0,0.0,0.0,0.0,0.0,0.0,0.02,0.02,0.02,0.02,0.0,0.0,0.0,,43.565,1.0,,,,,,mule holding with shelter and trough,literature/system proxy,,,35.0,0.0,350.0,350.0,,,,,,,,,,,,,0.0,,,,,,,,0.0,0.0,0.0,0.0,0.0,0.0,7.0,0.0,0.0,0.0,0.0,0.0,0.0,0.0,100.0,7.0,7.0,7.0,350.0,100.0,0.0,0.0,0.0,7.0,0.0,0.0,0.0,,,literature/system proxy,ESPAC livestock modules do not expose direct infrastructure/water/electricity variables for this row; literature/system proxy attached,WSU horse winter water note - Mule water proxy was scaled from the horse baseline by representative body weight because no ESPAC or Ecuador-specific mule water field was available. (https://s3.wp.wsu.edu/uploads/sites/2070/2024/01/1.24.pdf),350.0,350.0,0.002857142857142857,Animals_total_head multiplied by representative live weight to express kg live weight equivalent.,kg live weight equivalent,,dry-matter kg/head/day,dry-matter kg/head/day,no diet share data in ESPAC; literature proxy attached from config,no diet/ration fields found in other livestock module; literature proxy diet attached from inputs/02-05_espac_lci_coefficients.yml; main feed columns mapped from proxy diet components,mule_live,Non-Ecuador fallback inference,"Derived as 2.0% of body weight in dry matter, using the midpoint of the 1.75% to 2.25% maintenance guideline for a representative 350 kg mule.",Management recommendations for donkeys and mules - Ontario guidance gives 1.75% to 2.25% of body weight dry matter intake for maintenance in donkeys and mules; proxy uses the midpoint and a representative 350 kg body weight. (https://www.ontario.ca/page/management-recommendations-donkeys-and-mules)
Oriente,(all provinces confounded),ovine_live,ovine,1 kg meat (carcass-weight proxy),1.0,0.09540543262452163,2.1739130434782608,,0.7246376811594203,3.0,1.0,6.521739130434782,0.0,0.0,0.0,6.521739130434782,0.0,0.0,0.04555961595641623,0.0,2.1739130434782608,,,,,,,,,,,,,,0.0076252409863896645,0.00759526755483939,0.0,0.0,0.00759526755483939,8.992029465082152e-05,0.0,0.0,2.0746250530971727e-18,0.007685187849490213,0.0076252409863896645,0.005958718192194439,0.0016365493626449516,0.0,2.9973431550273838e-05,,27.08,6.0,,2.0,kid_goat,"kid goat, conventional, intensive forage area, at farm gate {FR} U",,grazing ovine holding with shelter and trough,literature/system proxy,,,7.6,0.0,60.44,362.64,,,,,,,,,,,,,99.6069182389937,,,,,,,,0.0,0.0,99.6069182389937,0.3930817610062893,0.0,0.0,1.272,1.267,0.0,0.0,1.267,0.005,0.0,0.0,9.069112511985665e-15,1.1535911115245767e-16,1.272,1.272,60.44,78.1,21.5,0.0,0.4,0.994,0.273,0.0,0.005,,,literature/system proxy,ESPAC livestock modules do not expose direct infrastructure/water/electricity variables for this row; literature/system proxy attached,FAO-linked livestock watering structures guideline - Reports feeder lamb and kid water requirements around 7.6 L/day and adult ewe or doe requirements above that level; 7.6 L/head/day was retained as a conservative live-animal proxy for mixed ovine rows. (https://www.fao.org/fileadmin/user_upload/emergencies/docs/UNEP_FAO_South_Sudan_WH_Structures_guidelines.pdf),166.8144,166.8144,0.005994686310054767,"Animals_total_head multiplied by representative live weight, then converted to estimated meat output with the configured carcass-yield proxy.",kg meat (carcass-weight proxy),head,dry-matter kg/head/day,dry-matter kg/head/day,no diet share data in ESPAC; literature proxy attached from config,"no diet/ration fields found in ovine module; literature proxy diet attached from inputs/02-05_espac_lci_coefficients.yml; main feed columns mapped from proxy diet as unmatched pasture for forage plus browse, with mineral or compound feed retained separately",ovine_live,Ecuador composite,Composite Ecuador proxy. Total intake is based on an ovine feeding trial; tree-forage share comes from Acacia mearnsii voluntary intake; mineral intake comes from a Blackbelly sheep grazing study in the Ecuadorian Amazon.,UTA thesis by Erika Esthefanía Lluay Guilcapi (bitstream 32507) - Reports voluntary dry matter intake of 1268.85 g/day in weaned sheep in Ecuador. (https://repositorio.uta.edu.ec/bitstream/123456789/32507/1/Tesis%20182%20Medicina%20Veterinaria%20y%20Zootecnia%20-Lluay%20Guilcapi%20Erika%20Esthefan%C3%ADa.pdf) | Evaluación de la preferencia de consumo de leguminosas arbóreas con potencial forrajero en rumiantes menores - Reports ovine Acacia mearnssi voluntary intake of 272.50 g/kg MS and 12.60 g/kg PV^0.75 at 60.44 kg live weight. (https://repositorio.uta.edu.ec/items/770d67bf-97e2-485a-8227-d941b7f4e1b2) | Effect of Mineral Supplementation on the Macromineral Concentration in Blood in Pre- and Postpartum Blackbelly Sheep - Reports 0.005 kg per animal per day mineral supplementation under free-grazing conditions in the Ecuadorian Amazon. (https://pmc.ncbi.nlm.nih.gov/articles/PMC7401505/)
Oriente,(all provinces confounded),swine_live,swine,1 kg meat (carcass-weight proxy),1.0,0.1556976114998181,1.5151515151515154,,0.7575757575757577,2.0,0.9372,2.8400000000000003,0.0,0.0,2.8400000000000003,0.0,0.0,0.0,0.04699393241198373,0.00041623197279185584,1.5151515151515154,,,,,,,,,,,,,,0.016783547289994188,0.0,0.0,0.0,0.0,0.007078293234082148,0.014156586468164296,0.011797155390136913,0.0,0.023594310780273825,,,,,,,30.02,3.0,,2.0,piglet,"piglet, at farm {BR} Economic, U",,Ecuador smallholder pigsty or swine pen with feeder and drinker,literature/system proxy,,,7.0,0.062,75.23,225.69,,,,,,,,,,,,,0.0,,,,,,,,0.0,0.0,0.0,30.0,50.0,40.0,2.5,0.0,0.0,0.0,0.0,0.75,1.25,1.0,0.0,0.0,2.5,,,,,,,,,,,,,literature/system proxy,ESPAC livestock modules do not expose direct infrastructure/water/electricity variables for this row; literature/system proxy attached,"FAO Livestock housing for pigs - Pig water consumption varies by class from about 2.5 L/day at 25 kg to 7.0 L/day at 90 to 120 kg; 7.0 L/head/day was adopted as a practical market-pig proxy for mixed ESPAC swine rows. (https://www.fao.org/3/s1250e/S1250E14.htm) | Caracterización de granjas porcinas de Banasur, Pasaje, El Oro - Provides Ecuador smallholder swine-system context and supports the use of a simple pen-based infrastructure proxy, although it does not provide a clean biological drinking-water factor. (https://polodelconocimiento.com/ojs/index.php/es/article/view/1043/html) | National Hog Farmer study summary - Finishing-barn electricity around 11.2 kWh per finished pig produced was annualized over a 180-day finishing period to derive a daily proxy. (https://www.nationalhogfarmer.com/livestock-management/study-goes-to-pig-barns-to-find-actual-energy-use)",148.9554,148.9554,0.006713418915997675,"Animals_total_head multiplied by representative live weight, then converted to estimated meat output with the configured carcass-yield proxy.",kg meat (carcass-weight proxy),head,as-fed kg/head/day,,"share-based, absolute kg/head/day estimated from configured intake assumption",common feed + supplement + waste shares from ESPAC swine module,,,,
Sierra,(all provinces confounded),cattle_live,cattle,1 kg meat (carcass-weight proxy),1.0,0.0017777777777777779,2.0,1.0,0.5,4.0,0.0673,0.5384,0.5384,0.0,0.0,0.0,0.0,0.0,0.048888888888888885,0.00013333333333333334,2.0,,,,,,,,,,,0.00041481481481481485,0.0,0.0008333333333333333,0.008888888888888889,0.007916666666666667,0.0035555555555555557,0.0,0.0,0.0004591567852437417,0.0,0.0,0.0,0.008358933333333334,,,,,,0.0044444444444444444,2.2,6.0,3.0,2.0,calf,"calf, at farm {BR} Economic, U",Mecánico,milking system: Mecánico,ESPAC direct (gl_sistema_ordenio),,,66.0,1.5,450.0,2400.0,,,,,,,,,,,,,90.0,0.44,0.0,1.0,100.0,0.0,0.065,0.0,80.0,0.0,0.0,10.0,,,12.0,9.6,8.0,0.0,0.0,1.2,0.0,0.0,0.0,0.0,12.0,,,,,,,,,,,6.0,100.0,mixed: direct ESPAC infrastructure + literature proxy water/electricity,infrastructure from ESPAC cattle milking-system field; water/electricity from literature proxy,"FAO small-scale dairy manual - Uses 4 to 6 L water per kg dry matter intake; the worked example for a 300 kg cow producing 10 kg milk/day gives about 66 L/day, adopted here as the dairy drinking-water proxy. (https://www.fao.org/4/t1265e/t1275e01.htm) | FAO Livestock housing water requirements - Reports dry dairy cow water requirements around 40 to 60 L/day, supporting the order of magnitude adopted for low-intensity tropical dairy systems. (https://www.fao.org/3/S1250E/S1250E12.htm) | Uruguay MGAP dairy intermediate-consumption report - Provides Latin American dairy infrastructure energy benchmarks for milking-room electricity and milk cooling; a rounded 1.5 kWh/cow/day proxy was adopted as a moderate regional milking-plus-cooling estimate. (https://www.gub.uy/ministerio-ganaderia-agricultura-pesca/sites/ministerio-ganaderia-agricultura-pesca/files/documentos/publicaciones/informe_consumo_intermedio.pdf)",1200.0,1200.0,0.0008333333333333334,"Animals_total_head multiplied by representative live weight, then converted to estimated meat output with the configured carcass-yield proxy.",kg meat (carcass-weight proxy),,as-fed kg/head/day,,"share-based, absolute kg/head/day estimated from configured intake assumption","pasture + supplement shares from ESPAC cattle module; pasture share split across linked cultivated pasture, linked natural pasture, and unmatched residual using holding-level ESPAC pasture areas",,,,
Sierra,(all provinces confounded),donkey_live,asnal,1 kg live weight equivalent,1.0,0.015333333333333332,,,,1.0,,,0.0,0.0,0.0,0.0,0.0,0.0,0.1,0.0,1.0,,,,,,,,,,,,,,0.02,0.0,0.0,0.0,0.0,0.0,0.0,0.0,0.02,0.02,0.02,0.02,0.0,0.0,0.0,,3.01,1.0,,,,,,donkey holding with shelter and trough,literature/system proxy,,,18.0,0.0,180.0,180.0,,,,,,,,,,,,,0.0,,,,,,,,0.0,0.0,0.0,0.0,0.0,0.0,3.6,0.0,0.0,0.0,0.0,0.0,0.0,0.0,100.0,3.6,3.6,3.6,180.0,100.0,0.0,0.0,0.0,3.6,0.0,0.0,0.0,,,literature/system proxy,ESPAC livestock modules do not expose direct infrastructure/water/electricity variables for this row; literature/system proxy attached,WSU horse winter water note - Donkey water proxy was scaled from the horse baseline by representative body weight because no ESPAC or Ecuador-specific donkey water field was available. (https://s3.wp.wsu.edu/uploads/sites/2070/2024/01/1.24.pdf),180.0,180.0,0.005555555555555556,Animals_total_head multiplied by representative live weight to express kg live weight equivalent.,kg live weight equivalent,,dry-matter kg/head/day,dry-matter kg/head/day,no diet share data in ESPAC; literature proxy attached from config,no diet/ration fields found in other livestock module; literature proxy diet attached from inputs/02-05_espac_lci_coefficients.yml; main feed columns mapped from proxy diet components,donkey_live,Non-Ecuador fallback inference,"Derived as 2.0% of body weight in dry matter, using the midpoint of the 1.75% to 2.25% maintenance guideline for a representative 180 kg donkey.","Management recommendations for donkeys and mules - Ontario guidance gives 1.75% to 2.25% of body weight dry matter intake for maintenance in donkeys and mules; proxy uses the midpoint and a representative 180 kg body weight. (https://www.ontario.ca/page/management-recommendations-donkeys-and-mules) | Feeding Donkeys Straw and Hay Q and A with The Donkey Sanctuary - Reports research-based guidance that donkeys need about 1.5% of their body weight per day in dry feed, supporting a forage-first maintenance proxy. (https://www.thehaypillow.com/blogs/news/feeding-donkeys-straw-and-hay-q-a-with-the-donkey-sanctuary)"
Sierra,(all provinces confounded),eggs,chicken,1 kg shell eggs,1.0,1.732204901572968e-06,0.061131893262971415,0.09169783989445712,,1.0,1.0,0.061131893262971415,0.0,0.0,0.0,0.0,0.0,0.061131893262971415,4.991153096423385e-07,2.2707498321565854e-08,0.061131893262971415,,,,,0.33917298772058113,1.0,0.33740467575027794,0.9947864009389804,0.01909937049576243,,,,,1.8210964000463703e-07,0.0,0.0,0.0,0.0,0.0,1.2140642666975804e-07,0.0,0.0,1.2140642666975804e-07,1.2140642666975804e-07,0.0,0.0,1.2140642666975804e-07,0.0,,0.858,30000.0,30000.0,,laying_hen,"laying hen <17 weeks, at farm {RER} Economic, U",,non-cage layer house on deep litter with drinkers and lighting,literature/system proxy,0.286,0.858,0.222,0.0101,1.514,30280.0,,,,,,150860.0,444787.77928,142950.0,421466.3466,5.6,15000.0,,0.0,,,,,,,,0.0,0.0,0.0,0.0,99.99999999999999,0.0,0.081,0.0,0.0,0.0,0.0,0.0,0.054,0.0,0.0,0.0,0.054,0.054,,0.0,0.0,100.0,0.0,0.0,0.0,0.054,0.0,,,literature/system proxy,ESPAC livestock modules do not expose direct infrastructure/water/electricity variables for this row; literature/system proxy attached,"Producción sostenible en avicultura - Reports 222.03 L per 1000 hens per day, equivalent to 0.222 L/hen/day; used as the preferred Latin American-style layer water proxy. (https://dokumen.pub/produccion-sostenible-en-avicultura-l-6359269.html) | FAO small-scale poultry production - Reports that a laying hen can consume up to about 0.25 L/day of water, supporting the adopted 0.222 L/hen/day proxy. (https://www.fao.org/4/y4628e/y4628e03.htm) | Iowa layer-house electricity summary - Layer-house electricity around 10.1 kWh/day per 1000 birds was used, equivalent to 0.0101 kWh/bird/day. (https://blogs.millersville.edu/aest/2022/05/13/dr-haughery-publishes-research-findings/) | FAO small-scale poultry production - Intensive deep-litter housing is described for egg production with about 3 to 4 birds per m2; the midpoint 3.5 birds per m2 was retained, equivalent to 0.286 m2 per hen, as the non-cage layer-house footprint proxy. (https://www.fao.org/4/y5169e/y5169e02.htm)",444787.77928,444787.77928,2.2482671605510746e-06,ESPAC egg counts are treated as weekly output and annualized with 52 periods/year before conversion to kg shell eggs using 0.056699 kg/egg; laying-hen live weight and feed are amortized over 1.50 producing years before normalization.,kg shell eggs/year,kg shell eggs/year,as-fed kg/head/day,as-fed kg/head/day,no diet share data in ESPAC; literature proxy attached from config,"no diet/ration fields found in avian module; literature proxy diet attached from inputs/02-05_espac_lci_coefficients.yml; main feed columns mapped from proxy diet as common compound feed, with no pasture or waste component",eggs,Ecuador direct,Semipasture or free-range scavenging was not quantified in the source; proxy covers balanced feed only.,Evaluación de parámetros productivos en crianza de gallinas criollas (gallina feliz). Patoa de Vallejo-Pujilí - Reports 0.081 ± 0.002 kg balanced feed per hen per day in a semipasture system in Cotopaxi. (https://repositorio.utc.edu.ec/handle/27000/7769)
Sierra,(all provinces confounded),goat_live,caprine,1 kg meat (carcass-weight proxy),1.0,0.10452749535925338,2.1739130434782608,,,1.0,1.0,2.1739130434782608,0.0,0.0,0.0,2.1739130434782608,0.0,0.0,0.22448015122873347,0.0,2.1739130434782608,,,,,,,,,,,,,,0.02388941398865784,0.023889413988657848,0.0,0.0,0.023889413988657848,0.0,0.0,0.0,0.0,0.023889413988657848,0.023889413988657848,0.018879962192816638,0.00500945179584121,0.0,0.0,,5.0,4.0,,,kid_goat,"kid goat, conventional, intensive forage area, at farm gate {FR} U",,grazing goat holding with shelter and trough,literature/system proxy,,,9.5,0.0,23.0,92.0,,,,,,,,,,,,,100.00000000000001,,,,,,,,0.0,0.0,100.00000000000001,0.0,0.0,0.0,1.011,1.0110000000000001,0.0,0.0,1.0110000000000001,0.0,0.0,0.0,0.0,0.0,1.0110000000000001,1.011,23.0,79.0,21.0,0.0,0.0,0.799,0.212,0.0,0.0,,,literature/system proxy,ESPAC livestock modules do not expose direct infrastructure/water/electricity variables for this row; literature/system proxy attached,FAO-linked livestock watering structures guideline - Reports ewe or doe water requirements around 9.5 L/day and milking ewe or doe requirements around 13.2 L/day; 9.5 L/head/day was adopted as a general goat live-animal proxy. (https://www.fao.org/fileadmin/user_upload/emergencies/docs/UNEP_FAO_South_Sudan_WH_Structures_guidelines.pdf),42.32,42.32,0.023629489603024575,"Animals_total_head multiplied by representative live weight, then converted to estimated meat output with the configured carcass-yield proxy.",kg meat (carcass-weight proxy),,dry-matter kg/head/day,dry-matter kg/head/day,no diet share data in ESPAC; literature proxy attached from config,"no diet/ration fields found in other livestock module; literature proxy diet attached from inputs/02-05_espac_lci_coefficients.yml; main feed columns mapped from proxy diet as unmatched pasture for forage plus browse, with mineral or compound feed retained separately",goat_live,Ecuador plus fallback composite,Composite proxy. Total intake is a fallback mature-doe dry matter intake example; tree-forage share is based on Ecuadorian caprine preference data and native browse literature from the Ecuadorian Sierra.,Evaluación de la preferencia de consumo de leguminosas arbóreas con potencial forrajero en rumiantes menores - Reports caprine Acacia melanoxylon voluntary intake of 211.07 g/kg MS and 20.155 g/kg PV^0.75 at 23 kg live weight. (https://repositorio.uta.edu.ec/items/770d67bf-97e2-485a-8227-d941b7f4e1b2) | Cabras Lecheras Selección y Hábitos de Consumo de Plantas Nativas en la Sierra Ecuatoriana - Ecuador review identifying native browse and shrub resources as a central component of dairy goat feeding in the Sierra. (https://polodelconocimiento.com/ojs/index.php/es/article/download/7592/pdf) | Goat Nutrition - Provides a mature-doe dry matter intake example of about 1.011 kg/day (2.23 lb/day) used as fallback total intake. (https://sfyl.ifas.ufl.edu/duval/agriculture-and-agribusiness-management/livestock-and-poultry/goats/goat-nutrition/)
